input_id,link,title,category,address,open_hours,popular_times,website,phone,plus_code,review_count,review_rating,reviews_per_rating,latitude,longitude,cid,status,descriptions,reviews_link,thumbnail,timezone,price_range,data_id,place_id,images,reservations,order_online,menu,owner,complete_address,about,user_reviews,user_reviews_extended,emails
92683d9a-1bf1-4c7d-8743-fae197d90613,https://www.google.com/maps/place/Health+in+Code/data=!4m7!3m6!1s0xd72f7d7fd2fccb3:0xc66f5871c5d96495!8m2!3d36.7154139!4d-4.4134868!16s%2Fg%2F11h7qzchms!19sChIJs8wv_df3cg0RlWTZxXFYb8Y?authuser=0&hl=es&rclk=1,Health in Code,Empresa de biotecnología,"P.º de la Farola, 16, Málaga-Este, 29016 Málaga","{""domingo"":[""Cerrado""],""jueves"":[""8:00–18:00""],""lunes"":[""8:00–18:00""],""martes"":[""8:00–18:00""],""miércoles"":[""8:00–18:00""],""sábado"":[""Cerrado""],""viernes"":[""8:00–18:00""]}",{},http://www.healthincode.com/,963 21 23 40,PH8P+5J Málaga,120,4.500000,"{""1"":3,""2"":3,""3"":6,""4"":24,""5"":84}",36.715414,-4.413487,14298744587598521493,,,,https://lh3.googleusercontent.com/gps-cs-s/AHVAweotVW6r9LpT2nhGgU9zcU5MmbE-cI_WN0rWpuGZI-fyioxFjAwocUwEZKT-vo4a5uBsI4r4cOUYm6zg32lNYU6kjWWrBdmKizd2oBv-ovnH4Qnjt1X0VxD7C0TL0t_ymK3K7WjM=w408-h544-k-no,Europe/Madrid,,0xd72f7d7fd2fccb3:0xc66f5871c5d96495,ChIJs8wv_df3cg0RlWTZxXFYb8Y,"[{""title"":""Todas"",""image"":""https://lh3.googleusercontent.com/gps-cs-s/AHVAweotVW6r9LpT2nhGgU9zcU5MmbE-cI_WN0rWpuGZI-fyioxFjAwocUwEZKT-vo4a5uBsI4r4cOUYm6zg32lNYU6kjWWrBdmKizd2oBv-ovnH4Qnjt1X0VxD7C0TL0t_ymK3K7WjM=w224-h298-k-no""},{""title"":""Street View y 360°"",""image"":""https://streetviewpixels-pa.googleapis.com/v1/thumbnail?panoid=XQjdQ0MBozkXLYZ0d-jMkA\u0026cb_client=maps_sv.tactile.gps\u0026w=224\u0026h=298\u0026yaw=113.27759\u0026pitch=0\u0026thumbfov=100""}]",null,null,"{""link"":"""",""source"":""""}","{""id"":""101955044316261037352"",""name"":""Health in Code (propietario)"",""link"":""https://www.google.com/maps/contrib/101955044316261037352""}","{""borough"":""Málaga-Este"",""street"":""P.º de la Farola, 16"",""city"":""Málaga"",""postal_code"":""29016"",""state"":""Málaga"",""country"":""ES""}","[{""id"":""accessibility"",""name"":""Accesibilidad"",""options"":[{""name"":""Acceso para sillas de ruedas"",""enabled"":true}]}]","[{""Name"":""Mónica Prieto"",""ProfilePicture"":""https://lh3.googleusercontent.com/a-/ALV-UjXh7oLRJTQzclyUL5UyR_qVa7-AJgfsvORkXCah-55N--l1HAPc=s120-c-rp-mo-ba2-br100"",""Rating"":5,""Description"":""Muy contenta con el servicio de Imegen Malaga. Pedir cita fue muy fácil y una vez allí, el tiempo de espera fue muy corto y me atendieron de forma eficaz. El personal es muy amable y respondieron todas mis preguntas. Recibí los resultados exactamente a la hora que me dijeron por email en inglés  y en español. Volveré a utilizar sus servicios en el futuro."",""Images"":null,""When"":""""},{""Name"":""Es G"",""ProfilePicture"":""https://lh3.googleusercontent.com/a-/ALV-UjXzeBof3q9ahZzojQI1T57kUvuNpgYCyF7JROBbY6h6M1crjy9d=s120-c-rp-mo-ba2-br100"",""Rating"":5,""Description"":""PCR 89€ , Me equivoque con las fechas ( gracias a q ellos me preguntaron cuando volaba) y me dieron otra cita sin cobrarme aunque ya me habían tomado la muestra! Y cuando no me llego el email con el resultado y llame no tardaron nada en enviarlo. Personal profesional y que no van a sacarte el dinero.\nSi tuviera q hacerme otra PCR volveria sin duda."",""Images"":null,""When"":""""},{""Name"":""Cecilia Bertacchini"",""ProfilePicture"":""https://lh3.googleusercontent.com/a-/ALV-UjWUKulH7FXUMHZQ9ZCD9EzQNPDPqBA5NeHWL6nyM_t9gPr0J2t0zg=s120-c-rp-mo-ba4-br100"",""Rating"":5,""Description"":""Excelente la atención, la velocidad tanto en la toma de muestra como del resultado. Y llega al mail para que uno pueda presentarlo en caso de viajar. Está señalizado , ya que la dirección te manda hacía la calle del frente pero siguiendo los carteles es fácil llegar a la entrada del lugar."",""Images"":null,""When"":""""},{""Name"":""Alberto Gómez Cruz"",""ProfilePicture"":""https://lh3.googleusercontent.com/a-/ALV-UjUd-0jGNPhnpCHwPGOUe0md7Lzeh3zjsoHMcZhmdvXeYYl0c5_ihA=s120-c-rp-mo-ba7-br100"",""Rating"":4,""Description"":""Hasta el momento realicé una reserva de número para hacerme un examen PCR por Covid 19 para viajar por el aeropuerto de Málaga. Hasta ahora el servicio de Imegen ha sido excelente. Confío que la quinta estrella llegue con el examen mismo, que será dentro de varios dias."",""Images"":null,""When"":""""},{""Name"":""marie B"",""ProfilePicture"":""https://lh3.googleusercontent.com/a-/ALV-UjXA12_SWDS7XiM66covYgCTCS-1-F1KxMR8_vl8wvWcmlEj3TtN=s120-c-rp-mo-ba5-br100"",""Rating"":5,""Description"":""La atención estupenda, buenos protocolos para el coronavirus, me ayudaron en todo lo que necesario.\nSolo una sugerencia: en la dirección que aparece, se debería especificar que como referencia es avenida Andalucía, pero indicar que es en un bajo a la izquierda de dicho edificio."",""Images"":null,""When"":""""},{""Name"":""Juan Sanchez"",""ProfilePicture"":""https://lh3.googleusercontent.com/a/ACg8ocL-s3IEXHEwW8AAMLVBZ18FNMRxJmmLM77S8t0J2_iOVoUTDA=s120-c-rp-mo-ba5-br100"",""Rating"":3,""Description"":""Precio ajustado. Rapidez en la entrega de resultados. Nos hicimos el pcr un sábado por la mañana y por la tarde nos enviaron los resultados. Hay que esperar en la calle."",""Images"":null,""When"":""""},{""Name"":""Miguel Angel González Ruiz"",""ProfilePicture"":""https://lh3.googleusercontent.com/a-/ALV-UjXB7o1nR46TSZbQmMUJ277B-6nACCOyTVPw2BcDf01Ust23XCj1=s120-c-rp-mo-ba5-br100"",""Rating"":5,""Description"":""Acudí para una prueba de antígenos del COVID19 y todo fue muy rápido y cómodo. El enfermero que nos atendió muy agradable y competente."",""Images"":null,""When"":""""},{""Name"":""ninajar84"",""ProfilePicture"":""https://lh3.googleusercontent.com/a-/ALV-UjWEu8dUnK7zt9VS3KrVCg7F19_VC12SNvQ518_ejXyOE-LqIAXk=s120-c-rp-mo-ba3-br100"",""Rating"":4,""Description"":""Aún no tengo experiencias, tengo una cita para el 8 de Junio para hacerme una PCR, sin embargo la atención por teléfono ha sido excelente."",""Images"":null,""When"":""""}]",null,
92683d9a-1bf1-4c7d-8743-fae197d90613,https://www.google.com/maps/place/Instituto+de+Fertilidad+Cl%C3%ADnica+Rinc%C3%B3n+S.L./data=!4m7!3m6!1s0xd725a84f228fe5f:0x3a14eabe96e57238!8m2!3d36.7127183!4d-4.2661497!16s%2Fg%2F11gcx_pmsk!19sChIJX_4o8oRacg0ROHLllr7qFDo?authuser=0&hl=es&rclk=1,Instituto de Fertilidad Clínica Rincón S.L.,Clínica de reproducción asistida,"Av. de la Torre, 24, 29730 Torre de Benagalbón, Málaga","{""domingo"":[""8:00–14:00""],""jueves"":[""8:00–14:00""],""lunes"":[""8:00–14:00""],""martes"":[""8:00–14:00""],""miércoles"":[""8:00–14:00""],""sábado"":[""8:00–14:00""],""viernes"":[""8:00–14:00""]}",{},http://www.rinconfertilidad.com/,900 525 248,PP7M+3G Torre de Benagalbón,41,4.200000,"{""1"":6,""2"":3,""3"":0,""4"":0,""5"":32}",36.712718,-4.266150,4185228058030338616,,,,https://lh3.googleusercontent.com/p/AF1QipOqbNVxx7hngKP7nSybUsSkY9gZJy6C2AlKR7vr=w408-h272-k-no,Europe/Madrid,,0xd725a84f228fe5f:0x3a14eabe96e57238,ChIJX_4o8oRacg0ROHLllr7qFDo,"[{""title"":""Todas"",""image"":""https://lh3.googleusercontent.com/p/AF1QipOqbNVxx7hngKP7nSybUsSkY9gZJy6C2AlKR7vr=w447-h298-k-no""},{""title"":""Del propietario"",""image"":""https://lh3.googleusercontent.com/p/AF1QipMaDKDG7TfuXvSePB9HdA0nZGwAb-PnWZuVN_FV=w447-h298-k-no""},{""title"":""Street View y 360°"",""image"":""https://streetviewpixels-pa.googleapis.com/v1/thumbnail?panoid=aHMUwhaqnDCAhLZbIMQJmA\u0026cb_client=maps_sv.tactile.gps\u0026w=224\u0026h=298\u0026yaw=142.6257\u0026pitch=0\u0026thumbfov=100""}]",null,null,"{""link"":"""",""source"":""""}","{""id"":""101587542956540057952"",""name"":""Instituto de Fertilidad Clínica Rincón S.L. (propietario)"",""link"":""https://www.google.com/maps/contrib/101587542956540057952""}","{""borough"":"""",""street"":""Av. de la Torre, 24"",""city"":""Torre de Benagalbón"",""postal_code"":""29730"",""state"":""Málaga"",""country"":""ES""}","[{""id"":""accessibility"",""name"":""Accesibilidad"",""options"":[{""name"":""Acceso para sillas de ruedas"",""enabled"":true},{""name"":""Aparcamiento adaptado para sillas de ruedas"",""enabled"":true},{""name"":""Aseo adaptado para sillas de ruedas"",""enabled"":true}]},{""id"":""amenities"",""name"":""Servicios"",""options"":[{""name"":""Aseos"",""enabled"":true}]},{""id"":""planning"",""name"":""Planificación"",""options"":[{""name"":""Se recomienda pedir cita"",""enabled"":true}]},{""id"":""payments"",""name"":""Pagos"",""options"":[{""name"":""Pagos con móvil vía NFC"",""enabled"":true},{""name"":""Tarjetas de crédito"",""enabled"":true},{""name"":""Tarjetas de débito"",""enabled"":true},{""name"":""Tarjetas de crédito"",""enabled"":false}]}]","[{""Name"":""milka marvakova"",""ProfilePicture"":""https://lh3.googleusercontent.com/a/ACg8ocLGa6gq9-4NaOCXlrV8QPIrRyz_bFQ4UwFxua-8QImKJ4t2SQ=s120-c-rp-mo-br100"",""Rating"":5,""Description"":""Yo y mi marido queremos agradecer a todo el equipo de la clínica por haber hecho realidad nuestro deseo de ser padres. En particular la doctora Pascual que nos guió durante todo el proceso con amabilidad y profesionalidad.\nMuchísimas gracias a tod@s. 🙂"",""Images"":null,""When"":""""},{""Name"":""Irina González"",""ProfilePicture"":""https://lh3.googleusercontent.com/a/ACg8ocIq1grHmGOhN7P7hEMFTW5O32dtlFLR8oisuQvE-BLoSa7_vg=s120-c-rp-mo-br100"",""Rating"":5,""Description"":""He recibido un increíble trato por cada personal de este centro , han estado pendiente de que estuviera al tanto de todo el procedimiento adecuadamente , tanto personal médico como no médico han sabido tratarme con cercanía y profesionalidad.\nEn los procedimientos médicos me he sentido muy bien atendida y con siempre con las precauciones adecuadas.\nEn el asesoramiento por parte de Carmen un increíble trato , con todas las dudas y posibles confusiones explicadas\nRecomiendo totalmente esta clínica para cada uno de sus tratamientos."",""Images"":null,""When"":""""},{""Name"":""Victoria Ortiz"",""ProfilePicture"":""https://lh3.googleusercontent.com/a/ACg8ocIqwzRaMCA-1hhhj1PZIKQTdmP5caQD4sZC5TxAWESFu10VxA=s120-c-rp-mo-br100"",""Rating"":5,""Description"":""Lo recomiendo al 100%. Mi experiencia en la seguridad social de Jaén fue nefasta pero decidi darme otra oportunidad y cuando vine a esta clínica,  en la primera consulta me explicaron el problema que tenía ( Lo cual ningún médico antes en 3 ciclos me habían explicado) después de la explicación, me hice 1 tratamiento,  me operé mi problema,  me hicieron la transferencia del embrión y actualmente estoy embarazada de un niño que esperamos con muchísimas ganas y todo gracias a ellos que nos han tratado y nos han ayudado de maravilla. ¡Son un equipo extraordinario!"",""Images"":null,""When"":""""},{""Name"":""Celia Calderón"",""ProfilePicture"":""https://lh3.googleusercontent.com/a-/ALV-UjWWZc4u64PQEfBHO5tfvVRgnagvckLRdIT7Wa079wAEiLEoOjPD=s120-c-rp-mo-br100"",""Rating"":5,""Description"":""El mejor centro de Málaga. Absolutamente todo el personal te trata con cercanía y cariño, todo tratamiento te es explicado claramente y con seguimientos prácticamente diarios ya sea vía Whatsapp o presencial. Cada caso es estudiado con paciencia y siempre están dispuestos a ayudarte con todo. Las doctoras son unas profesionales de pies a cabeza, pero hay que resaltar también a las enfermeras y a todo el personal en general. En especial a Carmen, que siempre está allí con una sonrisa y se preocupa tanto antes como después de absolutamente todo, es imposible no cogerle cariño.\nEn general una experiencia de 10 en todos los ámbitos."",""Images"":null,""When"":""""},{""Name"":""Rebeca Rico"",""ProfilePicture"":""https://lh3.googleusercontent.com/a/ACg8ocJe15k3Cw6ur4aBGrcfk4M0bYwGLwotOvYQuuVZ_EpuHIpCMQ=s120-c-rp-mo-ba3-br100"",""Rating"":5,""Description"":""Han hecho mi sueño realidad. El equipo es maravilloso y siempre ha estado disponible cuando lo he necesitado. Lola, Carolina y María, el equipo médico que me ha tratado y que me ha llevado de la mano con tanto esmero; Esther la directiva al frente de cualquier eventualidad; el equipo de embriología que el día de la transferencia sientes la importancia de su trabajo; las auxiliares que con tanto cariño se dirigen a ti…\nEl tratamiento es costoso, pero te dan facilidades y al final merece la pena. Los recomiendo al 100%, no solo por resultados (yo vine por una amiga que también se hizo un tratamiento y ahora es mamá), sino por la sensibilidad de todas ellas."",""Images"":null,""When"":""""},{""Name"":""Rad Garcia"",""ProfilePicture"":""https://lh3.googleusercontent.com/a/ACg8ocLNM8XlkCUK0Xb2BrPQXjuJBFf7tNPPo9LZozueAj3JAYOADQ=s120-c-rp-mo-br100"",""Rating"":1,""Description"":""Instituto de Fertilidad Rincón este centro no es confiable. Nos sometimos a FIV varias veces y no obtuvimos resultados. No recomiendo esta institución a nadie...!"",""Images"":null,""When"":""""},{""Name"":""Eva Viruel Ortiz"",""ProfilePicture"":""https://lh3.googleusercontent.com/a-/ALV-UjXXO8m8pl6Hhcmy0ZyDCuWiAaWHjsy-tNY-Zpu_L9K0-Yho8mo=s120-c-rp-mo-ba2-br100"",""Rating"":5,""Description"":""No tengo palabras para agradecer a Carolina Monedero el trato hacia nosotras, ya hicimos hace 4 años un tratamiento con ella y ahora estamos en proceso del segundo, el trato es inmejorable y la profesionalidad de 10, cada una de ellas que trabajan ayí son maravillosas, desde todas las doctoras, las enfermeras y hasta recepción, a cada persona que me pregunta le recomiendo clinica rincón fertilidad, por su manera de trabajar pero sobre todo por lo buena persona que es Carolina. También he coincidido con María  y lo mismo puedo decir de ella, ojalá no tenga que volver a otro tratamiento porque significaría que este ha funcionado, pero os recomendaré siempre!"",""Images"":null,""When"":""""},{""Name"":""Marta Soler Muñoz"",""ProfilePicture"":""https://lh3.googleusercontent.com/a/ACg8ocKdi-beW-94UrQjpuNbvI88gZ4fzaPoMZbt6N4pRHZd1KQMSQ=s120-c-rp-mo-br100"",""Rating"":1,""Description"":""No hay duda de que sois muy buenos en vuestra labor, pero me quedé fatal cuando me comunicásteis, a través de una llamada de teléfono, que mi reserva ovárica era muy baja y que me replantease la ovodinación. En ese momento se me vino el mundo encima, tanto por la noticia, como la manera de comunicarme el diagnóstico.\nDespués de un año de tratamiento psicológico y haber despertado de mi letargo, me he atrevido a contar mi experiencia.\nHe estado en otra clínica y, aunque el diagnóstico ha sido el mismo que me dísteis vosotros, las  maneras de comunicar y explicar las cosas han sido muy diferentes ."",""Images"":null,""When"":""""}]",null,
92683d9a-1bf1-4c7d-8743-fae197d90613,https://www.google.com/maps/place/Vithas+Centro+M%C3%A9dico+Rinc%C3%B3n+de+la+Victoria/data=!4m7!3m6!1s0xd725a845c608e75:0x2cd7cd78f5d4ef67!8m2!3d36.7134383!4d-4.2683481!16s%2Fg%2F1td7dhtm!19sChIJdY5gXIRacg0RZ-_U9XjN1yw?authuser=0&hl=es&rclk=1,Vithas Centro Médico Rincón de la Victoria,Centro médico,"Av. de la Torre, 15, 29730 Torre de Benagalbón, Málaga","{""domingo"":[""Cerrado""],""jueves"":[""8:00–21:00""],""lunes"":[""8:00–21:00""],""martes"":[""8:00–21:00""],""miércoles"":[""8:00–21:00""],""sábado"":[""Cerrado""],""viernes"":[""8:00–21:00""]}",{},https://vithas.es/centro/vithas-centro-medico-rincon-de-la-victoria/,951 00 01 00,PP7J+9M Torre de Benagalbón,638,3.100000,"{""1"":273,""2"":20,""3"":8,""4"":46,""5"":291}",36.713438,-4.268348,3231277177065762663,,,,https://lh3.googleusercontent.com/p/AF1QipNraHGJEBNbtf8xMp0rbYTXIGORiKORH-qwpUi8=w426-h240-k-no,Europe/Madrid,,0xd725a845c608e75:0x2cd7cd78f5d4ef67,ChIJdY5gXIRacg0RZ-_U9XjN1yw,"[{""title"":""Todas"",""image"":""https://lh3.googleusercontent.com/p/AF1QipNraHGJEBNbtf8xMp0rbYTXIGORiKORH-qwpUi8=w529-h298-k-no""},{""title"":""Más recientes"",""image"":""https://lh3.googleusercontent.com/gps-cs-s/AHVAweqiAJRgdYwBJNAYMBIxf38qujr8lD8X1lvCQYLQjlZeCJzSecCupwT2Xy5XFkCreCa2DAysRgBWmEKdtrl8jGFDcqqackPiZpp7DtS0ttLEjFEaYaw12A7LtC4J3tVfMoVQCjzDr9sdCvUw=w529-h298-k-no""},{""title"":""Vídeos"",""image"":""https://lh3.googleusercontent.com/gps-cs-s/AHVAweoqYNIfoELnzoqxcNNyKaMbpPiQXOB5Axb6BnakJDuyAFbFHYRqlPLppYOY_umBg8A5XweAtAGKeU3ZotAxDWxQzrX9XZ_HHhxDCfkpQPVuMBp8f6YAmEUimt95IisrJfgac6li=w224-h398-k-no""},{""title"":""Lobby"",""image"":""https://lh3.googleusercontent.com/gps-cs-s/AHVAwerBknI-AJfutUsJQXRCPcydAxqAHrcvgoERLxiQ-jkTdPxXc4PnORlPLV3b9ngV00TXC6eEib-04DwirAxrEuyRx6EhiCw2stTsDHvuxHV54-ZtmLSaVqm7JS4rJ9iBupCSp3n7vg=w224-h298-k-no""},{""title"":""Del propietario"",""image"":""https://lh3.googleusercontent.com/p/AF1QipP9c9UOhDn__bM0lBisR5CG7rarH0Z5KjZWG_un=w298-h298-k-no""},{""title"":""Street View y 360°"",""image"":""https://streetviewpixels-pa.googleapis.com/v1/thumbnail?panoid=MZ1Po8t3-y6LA1sz9LuZNQ\u0026cb_client=maps_sv.tactile.gps\u0026w=224\u0026h=298\u0026yaw=6.7386484\u0026pitch=0\u0026thumbfov=100""}]",null,"[{""link"":""https://areaprivada.vithas.es/login?utm_source=google+\u0026utm_medium=ficha_GMB\u0026utm_campaign=always_on_pedir_cita\u0026utm_content=CM_Rincon_Victoria"",""source"":""vithas.es""}]","{""link"":"""",""source"":""""}","{""id"":""106473511120102609625"",""name"":""Vithas Centro Médico Rincón de la Victoria (propietario)"",""link"":""https://www.google.com/maps/contrib/106473511120102609625""}","{""borough"":"""",""street"":""Av. de la Torre, 15"",""city"":""Torre de Benagalbón"",""postal_code"":""29730"",""state"":""Málaga"",""country"":""ES""}","[{""id"":""accessibility"",""name"":""Accesibilidad"",""options"":[{""name"":""Acceso para sillas de ruedas"",""enabled"":true},{""name"":""Aparcamiento adaptado para sillas de ruedas"",""enabled"":true},{""name"":""Aseo adaptado para sillas de ruedas"",""enabled"":true},{""name"":""Asientos adaptados sillas de ruedas"",""enabled"":false}]},{""id"":""amenities"",""name"":""Servicios"",""options"":[{""name"":""Aseos"",""enabled"":true}]},{""id"":""planning"",""name"":""Planificación"",""options"":[{""name"":""Se recomienda pedir cita"",""enabled"":true}]},{""id"":""payments"",""name"":""Pagos"",""options"":[{""name"":""Pagos con móvil vía NFC"",""enabled"":true},{""name"":""Tarjetas de crédito"",""enabled"":true},{""name"":""Tarjetas de débito"",""enabled"":true}]}]","[{""Name"":""Vic"",""ProfilePicture"":""https://lh3.googleusercontent.com/a/ACg8ocJjmc6IaaclaF4N8DfmDtQDXaHxkKBdHM7OwpIa3x9w9Cqo6-kF=s120-c-rp-mo-ba7-br100"",""Rating"":4,""Description"":""Mi experiencia en general ha sido positiva en las ocasiones que he acudido, pero sí que es cierto que en ocasiones se forman unas colas horribles y demoras en las consultas de bastante tiempo.\nPor suerte, los profesionales que atienden, dedican el tiempo necesario a cada paciente. Pero quizás desde el centro se tendría que gestionar de otra forma para no alargar tanto los tiempos de espera.\n\nDestacaría la buena atención del personal de enfermería (Paloma y María), así como de algunos médicos de familia."",""Images"":[""www.google.com/local/imagery/report/?cb_client=maps_sv.tactile\u0026image_key=!1e10!2sCIHM0ogKEICAgMCYmKKTLg\u0026fid=0x0:0x2cd7cd78f5d4ef67""],""When"":""2025-5-1""},{""Name"":""Irene Camarero"",""ProfilePicture"":""https://lh3.googleusercontent.com/a/ACg8ocLuDpBiUsGWXvQRLQ8CUZccSReRRMhaAQpNnBw4wNk0neF3=s120-c-rp-mo-br100"",""Rating"":5,""Description"":""Vithas Rincón es mi centro médico habitual. Estoy contenta con el servicio que ofrecen y toda la variedad de especialidades que tienen. Los empleados son muy amables, aunque en este momento quiero hacer una mención especial a M.Carmen, enfermera de radiología. Hace dos semanas fui por un bulto que me habian visto en el cuello, y ella hizo todo lo posible para que me atendieran en el día. Se nota que le gusta su trabajo, es una persona muy alegre y amable. Muchas gracias 🙏💕"",""Images"":null,""When"":""""},{""Name"":""Melina"",""ProfilePicture"":""https://lh3.googleusercontent.com/a/ACg8ocIAoBwX4IwBvR710DDcrFtANUZ1D5U_YKcGCIjzq_H8ITwypZw=s120-c-rp-mo-br100"",""Rating"":5,""Description"":""Hemos ido mi madre y yo por un accidente de tráfico y la recepcionista María José nos ha atendido súper bien y explicado todo muy bien. Una chica muy empatica, y simpática!!"",""Images"":null,""When"":""""},{""Name"":""Anita B."",""ProfilePicture"":""https://lh3.googleusercontent.com/a/ACg8ocJgq2c18W9jqZNqtQFGonAmuBfS79I3uNlrkmWpGrpFTFFFxA=s120-c-rp-mo-ba4-br100"",""Rating"":5,""Description"":""En este centro todo el personal es muy amable, pero tengo que destacar a la enfermera Mari Carmen Guerrero, es un amor de persona y muy eficiente. Me ha solucionado las citas enlazadas en dos minutos. Muy atenta, una gran profesional.\nY los médicos, según mi experiencia son muy amables y buenos profesionales.\nEl personal de radiología es un amor.\nYo sólo tengo buenas palabras para este centro."",""Images"":null,""When"":""""},{""Name"":""SonyBravia Las Brisas"",""ProfilePicture"":""https://lh3.googleusercontent.com/a/ACg8ocJ_OWZ3603eMeXr0IIgS7iWYK9smFnv6gI0SY0O7YErdtxPtQ=s120-c-rp-mo-br100"",""Rating"":1,""Description"":""He tenido consulta con Maria Pilar Villalba, traumatologa, y me parece increíble el trato recibido y la poca empatía. Si me preguntan no la voy a recomendar, ya sé a que especialista no acudiré mas."",""Images"":null,""When"":""""},{""Name"":""Toni Castro"",""ProfilePicture"":""https://lh3.googleusercontent.com/a/ACg8ocIHJt109DIOCgqZTQoXr1YWbfzCP_VszJZxtGND8hR6cfs-GA=s120-c-rp-mo-br100"",""Rating"":5,""Description"":""Llevó tiempo dando sesiones en vithas Rincón. Mi felicidades a las chicas de la mañana Carmen y Tony. Gracias y a Tony decirte que se nota que te apasiona tú trabajo en estos días me has tratado súper cosas que no me han hecho antes. Mi agradecimiento a las dos"",""Images"":null,""When"":""""},{""Name"":""Alice"",""ProfilePicture"":""https://lh3.googleusercontent.com/a-/ALV-UjUI8cXUGequpJ-zV_6B1Tsze0ctqoEVJLqUZFVFIf10FoSu8hR9=s120-c-rp-mo-ba3-br100"",""Rating"":1,""Description"":""⭐☆☆☆☆\nMuy mala atención en el centro médico Vithas Salud. Tenía cita programada y aun así no me resolvieron el problema, mientras que a la persona anterior sí la atendieron correctamente. Me parece una falta total de profesionalidad y de respeto hacia los pacientes. He perdido mi tiempo y sigo con el mismo problema, sin ninguna explicación ni solución."",""Images"":null,""When"":""""},{""Name"":""Francisco Ramirez"",""ProfilePicture"":""https://lh3.googleusercontent.com/a/ACg8ocJT5uLRF3AWYlbu1dO2fZHZssfNVsdINgRMPrHUcOITIA3EpA=s120-c-rp-mo-ba2-br100"",""Rating"":1,""Description"":""Con cita para médico de cabecera casi 1h esperando un jueves con cita a las 9am. Increíble que hagan a los clientes perder el tiempo de tal manera por no incrementar recursos. Es lamentable, peor que la seguridad social."",""Images"":null,""When"":""""}]",null,
