input_id,link,title,category,address,open_hours,popular_times,website,phone,plus_code,review_count,review_rating,reviews_per_rating,latitude,longitude,cid,status,descriptions,reviews_link,thumbnail,timezone,price_range,data_id,place_id,images,reservations,order_online,menu,owner,complete_address,about,user_reviews,user_reviews_extended,emails
92683d9a-1bf1-4c7d-8743-fae197d90613,https://www.google.com/maps/place/Opticalia+Rinc%C3%B3n+de+la+Victoria/data=!4m7!3m6!1s0xd725a7009684569:0x2e2391dd032d561a!8m2!3d36.7149143!4d-4.2845235!16s%2Fg%2F11gty1xxy4!19sChIJaUVoCXBacg0RGlYtA92RIy4?authuser=0&hl=es&rclk=1,Opticalia Rincón de la Victoria,Óptica,"Av. del Mediterráneo, 116, 29730 Rincón de la Victoria, Málaga","{""domingo"":[""Cerrado""],""jueves"":[""9:45–13:30"",""17:00–19:30""],""lunes"":[""9:45–13:30"",""17:00–19:30""],""martes"":[""9:45–13:30"",""17:00–19:30""],""miércoles"":[""9:45–13:30"",""17:00–19:30""],""sábado"":[""10:00–13:30""],""viernes"":[""9:30–14:00""]}",{},https://www.opticalia.com/es/tiendas/optica-rincon-de-la-victoria-avda-del-mediterraneo-116-opticalia,952 12 31 29,PP78+X5 Rincón de la Victoria,150,4.900000,"{""1"":4,""2"":0,""3"":0,""4"":2,""5"":144}",36.714914,-4.284523,3324661328356660762,,,,https://lh3.googleusercontent.com/p/AF1QipNy_YKSUdFHAexnSaMc4BxGIZYRPW-75vM-RRXP=w408-h306-k-no,Europe/Madrid,,0xd725a7009684569:0x2e2391dd032d561a,ChIJaUVoCXBacg0RGlYtA92RIy4,"[{""title"":""Todas"",""image"":""https://lh3.googleusercontent.com/p/AF1QipNy_YKSUdFHAexnSaMc4BxGIZYRPW-75vM-RRXP=w397-h298-k-no""},{""title"":""Gafas de sol"",""image"":""https://lh3.googleusercontent.com/p/AF1QipPr6mHu0nomkLW-bM5YFXhqMuo1_XUkPJOqEV8o=w397-h298-k-no""},{""title"":""Del propietario"",""image"":""https://lh3.googleusercontent.com/p/AF1QipOvZFc8WlqwXV0pd_VrxeTohz01_N0VnLuLysMN=w422-h298-k-no""},{""title"":""Street View y 360°"",""image"":""https://streetviewpixels-pa.googleapis.com/v1/thumbnail?panoid=BYq01Ks3Qmo0Bp8vtSW-Rw\u0026cb_client=maps_sv.tactile.gps\u0026w=224\u0026h=298\u0026yaw=176.6281\u0026pitch=0\u0026thumbfov=100""}]",null,null,"{""link"":"""",""source"":""""}","{""id"":""104583285465840408904"",""name"":""Opticalia Rincón de la Victoria (propietario)"",""link"":""https://www.google.com/maps/contrib/104583285465840408904""}","{""borough"":"""",""street"":""Av. del Mediterráneo, 116"",""city"":""Rincón de la Victoria"",""postal_code"":""29730"",""state"":""Málaga"",""country"":""ES""}","[{""id"":""service_options"",""name"":""Opciones de servicio"",""options"":[{""name"":""Recogida en tienda"",""enabled"":true},{""name"":""Compra en tienda"",""enabled"":true},{""name"":""Servicios en las instalaciones"",""enabled"":true},{""name"":""Ofrece asistencia en otros idiomas"",""enabled"":false}]},{""id"":""accessibility"",""name"":""Accesibilidad"",""options"":[{""name"":""Acceso para sillas de ruedas"",""enabled"":true},{""name"":""Aparcamiento adaptado para sillas de ruedas"",""enabled"":true},{""name"":""Aseo adaptado para sillas de ruedas"",""enabled"":true}]},{""id"":""amenities"",""name"":""Servicios"",""options"":[{""name"":""Aseos"",""enabled"":true},{""name"":""Aseos unisex"",""enabled"":true}]},{""id"":""planning"",""name"":""Planificación"",""options"":[{""name"":""Visita rápida"",""enabled"":true}]},{""id"":""payments"",""name"":""Pagos"",""options"":[{""name"":""Pagos con móvil vía NFC"",""enabled"":true},{""name"":""Tarjetas de crédito"",""enabled"":true},{""name"":""Tarjetas de débito"",""enabled"":true},{""name"":""Tarjetas de crédito"",""enabled"":false}]}]","[{""Name"":""Keka"",""ProfilePicture"":""https://lh3.googleusercontent.com/a/ACg8ocLBmM51FZYBqhjRFHZ4U1pUzI3TMbtlGZPaqO3m5V8oqx62ig=s120-c-rp-mo-br100"",""Rating"":5,""Description"":""Alberto y Patricia grandes profesionales y con una gran sensibilidad.En un momento muy difícil, nos atendieron con una humanidad y una empatía enormes. Nos hicieron las gafas rapidísimo, sin poner trabas, solo con ganas de ayudarnos(un gesto que no olvidaremos)\nGracias de corazón ."",""Images"":null,""When"":""""},{""Name"":""Ramón Broceño Caminero"",""ProfilePicture"":""https://lh3.googleusercontent.com/a-/ALV-UjWIcoRfx6D7efzYnfhjbCQyoSJlSbgghv7z7Tvx5hvEc6ru6x0u=s120-c-rp-mo-ba2-br100"",""Rating"":5,""Description"":""Gracias!! Patricia y Alberto por vuestra profesionalidad y el trato cercano. Me hicieron dos pares de gafas progresivas, de sol y graduadas, a las que me adapté desde el primer momento. Además, a un precio estupendo. Servicio post-venta excelente. 100% recomendables."",""Images"":null,""When"":""""},{""Name"":""V MB"",""ProfilePicture"":""https://lh3.googleusercontent.com/a/ACg8ocKiCnxCfweKJdjkab8qrcg7q1kzVCtjSlUY25FCX0g4wbRW2Q=s120-c-rp-mo-ba3-br100"",""Rating"":5,""Description"":""El trato por parte de Alberto y Patricia es inmejorable. Te tratan con mucho agrado y cercanía, y te resuelven cualquier duda que tengas. Ya son varias las gafas que me he hecho con ellos, y además los he recomendado a más miembros de mi familia, que también han quedado contentos y se han hecho clientes. ¡Muchas gracias por vuestra atención y profesionalidad, chicos! :)"",""Images"":null,""When"":""""},{""Name"":""salvador molina"",""ProfilePicture"":""https://lh3.googleusercontent.com/a-/ALV-UjXI2RvCl9Hf7Pa6RIcnAn3UqX6NFI4A0dKle6pCpKXCo8I-2k6T=s120-c-rp-mo-br100"",""Rating"":5,""Description"":""Excelente trato y mucha profesionalidad. Muy contento con mis nuevas gafas !!! Gracias"",""Images"":null,""When"":""""},{""Name"":""Francisco Javier Malpica Gómez"",""ProfilePicture"":""https://lh3.googleusercontent.com/a-/ALV-UjXIrOywpPaJThd357FLZ-TxFYOCh9GyrYrDnby9tKJTYnEBlKth=s120-c-rp-mo-br100"",""Rating"":5,""Description"":""Gran variedad de gafas y sobre todo un trato excepcional!. Totalmente recomendable"",""Images"":null,""When"":""""},{""Name"":""Nazaret Roldan"",""ProfilePicture"":""https://lh3.googleusercontent.com/a/ACg8ocKv3lVRUSp4pcRPJOhYZY58nmFFMFYwFtbQ2AOV8rAjHTlrSA=s120-c-rp-mo-br100"",""Rating"":5,""Description"":""Óptica maravillosa atención personalizada personal amable a nivel pro... Sin duda establecimiento de confianza..."",""Images"":null,""When"":""""},{""Name"":""Maria Jose Rosado"",""ProfilePicture"":""https://lh3.googleusercontent.com/a/ACg8ocLZpqJ01upWejt0v2xYRcQJWy7SVEFNfst8lh_0T1mjP9LqPA=s120-c-rp-mo-br100"",""Rating"":5,""Description"":""Un trato inigualable,simpaticos , tanto Patricia como Alberto,super profesionales, me voy encantada"",""Images"":null,""When"":""""},{""Name"":""Francisco José Romero"",""ProfilePicture"":""https://lh3.googleusercontent.com/a/ACg8ocIkzshiv0aILCROhAnIaRyQyORyQOsKsPjQl-zXAJ4RJe6swg=s120-c-rp-mo-ba4-br100"",""Rating"":5,""Description"":""Si buscas unas gafas, deberías visitar esta óptica.\nTienen una buena variedad.\nLa atención al cliente es cercana, competente, agradable y diligente.\nEl ambiente es agradable y luminoso.\nTuve un problema con la montura de una de las gafas que adquirí en el establecimiento y me la solventaron adecuadamente. Esta atención, lamentablemente, no se suele ver en la actualidad.\nLo dicho, si buscas unas gafas, una buena atención y una óptica en la que confiar, no lo pienses y visítala."",""Images"":[""www.google.com/local/imagery/report/?cb_client=maps_sv.tactile\u0026image_key=!1e10!2sCIHM0ogKEICAgICBu-q_aA\u0026fid=0x0:0x2e2391dd032d561a""],""When"":""2023-1-5""}]",null,
92683d9a-1bf1-4c7d-8743-fae197d90613,https://www.google.com/maps/place/Better2Know+Malaga/data=!4m7!3m6!1s0xd72f7950334a891:0xea07465a0709728!8m2!3d36.7178863!4d-4.4321788!16s%2Fg%2F11gyyzmb97!19sChIJkag0A5X3cg0RKJdwoGV0oA4?authuser=0&hl=es&rclk=1,Better2Know Malaga,,"C. Compositor Lehmberg Ruiz, 10 - Bajo, Distrito Centro, 29007 Málaga","{""domingo"":[""Cerrado""],""jueves"":[""9:00–17:00""],""lunes"":[""9:00–17:00""],""martes"":[""9:00–17:00""],""miércoles"":[""9:00–17:00""],""sábado"":[""Cerrado""],""viernes"":[""9:00–17:00""]}",{},https://www.better2know.com/es-es/clinics/malaga,800 810 063,PH99+54 Málaga,1,5.000000,"{""1"":0,""2"":0,""3"":0,""4"":0,""5"":1}",36.717886,-4.432179,1053970292636948264,,,,https://streetviewpixels-pa.googleapis.com/v1/thumbnail?panoid=vJhADGyR0UvuChhDTZ-doQ&cb_client=search.gws-prod.gps&w=408&h=240&yaw=1.5560812&pitch=0&thumbfov=100,Europe/Madrid,,0xd72f7950334a891:0xea07465a0709728,ChIJkag0A5X3cg0RKJdwoGV0oA4,"[{""title"":""Todas"",""image"":""https://streetviewpixels-pa.googleapis.com/v1/thumbnail?panoid=vJhADGyR0UvuChhDTZ-doQ\u0026cb_client=maps_sv.tactile.gps\u0026w=224\u0026h=298\u0026yaw=1.5560812\u0026pitch=0\u0026thumbfov=100""},{""title"":""Street View y 360°"",""image"":""https://streetviewpixels-pa.googleapis.com/v1/thumbnail?panoid=vJhADGyR0UvuChhDTZ-doQ\u0026cb_client=maps_sv.tactile.gps\u0026w=224\u0026h=298\u0026yaw=1.5560812\u0026pitch=0\u0026thumbfov=100""}]",null,"[{""link"":""https://www.better2know.es/clinics/es/book-online/choose-clinic"",""source"":""better2know.es""}]","{""link"":"""",""source"":""""}","{""id"":""115765786171805227365"",""name"":""Better2Know Malaga (propietario)"",""link"":""https://www.google.com/maps/contrib/115765786171805227365""}","{""borough"":""Distrito Centro"",""street"":""C. Compositor Lehmberg Ruiz, 10 - Bajo"",""city"":""Málaga"",""postal_code"":""29007"",""state"":""Málaga"",""country"":""ES""}","[{""id"":""accessibility"",""name"":""Accesibilidad"",""options"":[{""name"":""Acceso para sillas de ruedas"",""enabled"":true},{""name"":""Aseo adaptado para sillas de ruedas"",""enabled"":true}]},{""id"":""amenities"",""name"":""Servicios"",""options"":[{""name"":""Aseos"",""enabled"":true}]},{""id"":""planning"",""name"":""Planificación"",""options"":[{""name"":""Se recomienda pedir cita"",""enabled"":true}]},{""id"":""payments"",""name"":""Pagos"",""options"":[{""name"":""Pagos con móvil vía NFC"",""enabled"":true},{""name"":""Tarjetas de crédito"",""enabled"":true},{""name"":""Tarjetas de débito"",""enabled"":true}]}]","[{""Name"":""Beatriz Márquez"",""ProfilePicture"":""https://lh3.googleusercontent.com/a-/ALV-UjVb8ifFpJQayyyE7H36SsoVD39SjTpD56BydhhagYzW5fPJYvlyIg=s120-c-rp-mo-br100"",""Rating"":5,""Description"":""Destacar la profesionalidad, el buen hacer , la simpatía y sobre todo calidad humana, de dos profesionales del centro de Compositor Lemberg que son Sonia y Lina , sin duda su trato y trabajo hacen que un centro como este tenga cada vez más prestigio , gracias por todo siempre."",""Images"":null,""When"":""""}]",null,
92683d9a-1bf1-4c7d-8743-fae197d90613,https://www.google.com/maps/place/%C3%93ptica+y+Centro+Auditivo+Soloptical+Rinc%C3%B3n+de+la+Victoria/data=!4m7!3m6!1s0xd725a1f09978465:0xb00ee989ed415acf!8m2!3d36.7236665!4d-4.3134202!16s%2Fg%2F11g9f7ytcd!19sChIJZYSXCR9acg0Rz1pB7YnpDrA?authuser=0&hl=es&rclk=1,Óptica y Centro Auditivo Soloptical Rincón de la Victoria,Óptica,"C. Arroyo Totalán, 36, C.C, 29720 Rincón de la Victoria, Málaga","{""domingo"":[""12:00–20:00""],""jueves"":[""10:00–22:00""],""lunes"":[""10:00–22:00""],""martes"":[""10:00–22:00""],""miércoles"":[""10:00–22:00""],""sábado"":[""10:00–22:00""],""viernes"":[""10:00–22:00""]}",{},https://soloptical.net/es/soloptical-rincon/?utm_source=Google&utm_medium=google_my_business&utm_campaign=sitio+web,682 69 34 97,PMFP+FJ Rincón de la Victoria,2930,5.000000,"{""1"":8,""2"":1,""3"":1,""4"":58,""5"":2862}",36.723667,-4.313420,12686333978949540559,,,,https://lh3.googleusercontent.com/gps-cs-s/AHVAwep_NgGmctjv2g8CipRbXvwdktaSkt4C03D8fHKpk_OmhqSTUum-ZwyeEXgE0m-oMt_O0ZwFGlEmGUwrEHgeRBGluHVhcefwz_Bz1UWog6JhcP1yZkLU5_bkWXml96Z0UoFGsHeO=w408-h306-k-no,Europe/Madrid,,0xd725a1f09978465:0xb00ee989ed415acf,ChIJZYSXCR9acg0Rz1pB7YnpDrA,"[{""title"":""Todas"",""image"":""https://lh3.googleusercontent.com/gps-cs-s/AHVAwep_NgGmctjv2g8CipRbXvwdktaSkt4C03D8fHKpk_OmhqSTUum-ZwyeEXgE0m-oMt_O0ZwFGlEmGUwrEHgeRBGluHVhcefwz_Bz1UWog6JhcP1yZkLU5_bkWXml96Z0UoFGsHeO=w397-h298-k-no""},{""title"":""Street View y 360°"",""image"":""https://lh3.googleusercontent.com/gps-cs-s/AHVAwerTbmlwOi01NIfJ1bWImnNTDTOi-bHS3MS_mPB47iqPufDGN_7o-BU1A5w3rJHXBj5qnVhxBrnSmAbLoRlncIREspW2WHrPrI-mbDsV_FM8c6aHh24r6rjgULOBAmkwt5kIjQ1i=w224-h298-k-no-pi-0-ya141.12498-ro-0-fo100""}]",null,null,"{""link"":"""",""source"":""""}","{""id"":""117048909179484862662"",""name"":""Óptica y Centro Auditivo Soloptical Rincón de la Victoria (propietario)"",""link"":""https://www.google.com/maps/contrib/117048909179484862662""}","{""borough"":"""",""street"":""C. Arroyo Totalán, 36, C.C"",""city"":""Rincón de la Victoria"",""postal_code"":""29720"",""state"":""Málaga"",""country"":""ES""}","[{""id"":""service_options"",""name"":""Opciones de servicio"",""options"":[{""name"":""Recogida en tienda"",""enabled"":true},{""name"":""A domicilio"",""enabled"":false}]},{""id"":""accessibility"",""name"":""Accesibilidad"",""options"":[{""name"":""Acceso para sillas de ruedas"",""enabled"":true},{""name"":""Aparcamiento adaptado para sillas de ruedas"",""enabled"":true}]},{""id"":""planning"",""name"":""Planificación"",""options"":[{""name"":""Visita rápida"",""enabled"":true}]},{""id"":""payments"",""name"":""Pagos"",""options"":[{""name"":""Pagos con móvil vía NFC"",""enabled"":true},{""name"":""Tarjetas de crédito"",""enabled"":true},{""name"":""Tarjetas de débito"",""enabled"":true}]}]","[{""Name"":""Wadi Araba"",""ProfilePicture"":""https://lh3.googleusercontent.com/a-/ALV-UjVB-_P2zLIL7Jk38ChPhc0OaTg-v2b_aMphCQ67wn4lQKdUxVX2=s120-c-rp-mo-br100"",""Rating"":5,""Description"":""Son encantadoras y me han arreglado las varillas sin pedir nada a cambio. Además tienen muy buenos precios. Lo recomiendo!!!!"",""Images"":null,""When"":""""},{""Name"":""Pepe Castro"",""ProfilePicture"":""https://lh3.googleusercontent.com/a/ACg8ocKNW681_R2NYXcRXPXaTiLa_TTmxFGr2ibZhZO7pQE3azM=s120-c-rp-mo-br100"",""Rating"":5,""Description"":""Atención personalizada. Amabilidad y encanto en el trato ajustándose en todo momento a lo que quería adquirir. La recomiendo sin ningún género de dudas. Volvería a comprar aquí. Especial mención para Irene."",""Images"":null,""When"":""""},{""Name"":""Marta Toledo"",""ProfilePicture"":""https://lh3.googleusercontent.com/a/ACg8ocLhoAJumLPDGupezDaZYq6XqAnW_M6ytOxlmHDo9fTwWbHySA=s120-c-rp-mo-br100"",""Rating"":5,""Description"":""Me atendió Alicia y el trato fue simplemente fantástico. Desde el primer momento mostró una paciencia increíble, ya que me costaba decidirme por cuál llevarme. Y en todo momento se mostró amable y cercana. Sin duda, una atención de 10 que se agradece muchísimo."",""Images"":null,""When"":""""},{""Name"":""Ana Román"",""ProfilePicture"":""https://lh3.googleusercontent.com/a/ACg8ocL3Pi27dVtKW0FadARKlDz-oPsle4H5htpTMSFMicL0MFHEiw=s120-c-rp-mo-br100"",""Rating"":5,""Description"":""El año pasado empecé a usar gafas de soloptical y mi experiencia ha sido maravillosa. Si necesitas cualquier cosa siempre están para ayudar, te asesoran muy bien y la calidad es muy buena. Lo recomiendo 100%"",""Images"":null,""When"":""""},{""Name"":""kremena krasimirova ivanova"",""ProfilePicture"":""https://lh3.googleusercontent.com/a/ACg8ocLu1b2smvy_BVOeqlF-hQNXVguwBwOVU60Uuf_vGYCfn1ka-w=s120-c-rp-mo-br100"",""Rating"":5,""Description"":""Una experiencia excelente. Desde el primer momento me atendieron con amabilidad y paciencia, explicándome cada detalle de la revisión de la vista. El personal es muy profesional y se nota que se preocupan realmente por el bienestar visual, no solo por vender gafas. Quiero destacar especialmente a Kamelia, quien me asesoró con una atención cercana y muy personalizada. Gracias a ella encontré las gafas perfectas, que no solo mejoran mi visión, sino que también me hacen sentir cómoda y segura. La variedad de monturas es amplia y de calidad, con opciones modernas y elegantes para todos los gustos. Estoy encantada con el resultado: veo mejor que nunca. Sin duda, una óptica que recomiendo al 100 %."",""Images"":null,""When"":""""},{""Name"":""Paula Ibañez Marin"",""ProfilePicture"":""https://lh3.googleusercontent.com/a-/ALV-UjWg0DUhW-rCC6K0ZBXiiBaaSHfOMxHPUD2L9ccpIseUGZuuIjxE=s120-c-rp-mo-br100"",""Rating"":5,""Description"":""Paula e Irene han sido encantadoras. Mi tía y yo hemos estado buscando 2 gafas y nos han tratado genial. Hemos conseguido el objetivo y encima a un buen precio. Muchas gracias por todo."",""Images"":null,""When"":""""},{""Name"":""Juan Manuel Jurado Lugo"",""ProfilePicture"":""https://lh3.googleusercontent.com/a-/ALV-UjWW4yEIJvfh4twi6b8NSG6zQ9O2CAn0TXqtT8C0d8ajpVNOMTz7yw=s120-c-rp-mo-ba2-br100"",""Rating"":5,""Description"":""⭐⭐⭐⭐⭐\nQuiero destacar la excelente atención de José Luis, óptico en Soloptical de La Cala del Moral (Rincón de la Victoria). Después de haber visitado otros centros Soloptical sin que me dieran una solución a mis gafas, que resultaron tener un defecto de fábrica, José Luis se tomó el tiempo de revisar todo con gran profesionalidad, amabilidad y dedicación.\nGracias a su atención y compromiso, logró resolver mi problema y me fui completamente satisfecho. Es un verdadero placer encontrar profesionales tan implicados y competentes como él. ¡Totalmente recomendable!\n\nGracias Jose Luis!"",""Images"":null,""When"":""""},{""Name"":""Antonio Ramírez López"",""ProfilePicture"":""https://lh3.googleusercontent.com/a-/ALV-UjW1Kfj8KOD1p7zdTxxtRIghepJgARzSjtDpCaxs5QVTlhENE2qY=s120-c-rp-mo-br100"",""Rating"":5,""Description"":""Servicio impecable y rápido. Paula muy profesional, amable y resolutiva. Así da gusto venir a sitios incluso en estas fechas."",""Images"":null,""When"":""""}]",null,
92683d9a-1bf1-4c7d-8743-fae197d90613,https://www.google.com/maps/place/Open+House+M%C3%A1laga+%7C+Cl%C3%ADnica+de+An%C3%A1lisis+de+ETS/data=!4m7!3m6!1s0xd72f75226e4d6c9:0x51a905ac705b2e2d!8m2!3d36.7314201!4d-4.4182383!16s%2Fg%2F11x5krrq3l!19sChIJydbkJlL3cg0RLS5bcKwFqVE?authuser=0&hl=es&rclk=1,Open House Málaga | Clínica de Análisis de ETS,Especialista en enfermedades infecciosas,"Alameda de Capuchinos, 49, Bajo, Distrito Centro, 29014 Málaga","{""domingo"":[""Cerrado""],""jueves"":[""10:00–14:00"",""16:00–20:00""],""lunes"":[""10:00–14:00"",""16:00–20:00""],""martes"":[""10:00–14:00"",""16:00–20:00""],""miércoles"":[""10:00–14:00"",""16:00–20:00""],""sábado"":[""Cerrado""],""viernes"":[""10:00–14:00"",""16:00–20:00""]}",{},https://openhouse.es/centro-medico-colaborador-open-house-malaga,951 79 09 99,PHJJ+HP Málaga,1,5.000000,"{""1"":0,""2"":0,""3"":0,""4"":0,""5"":1}",36.731420,-4.418238,5884240626313801261,,,,https://lh3.googleusercontent.com/p/AF1QipNKSMKUXcace8RAiJmVtrGC_KLbVyt4acvixHiN=w408-h408-k-no,Europe/Madrid,,0xd72f75226e4d6c9:0x51a905ac705b2e2d,ChIJydbkJlL3cg0RLS5bcKwFqVE,"[{""title"":""Todas"",""image"":""https://lh3.googleusercontent.com/p/AF1QipNKSMKUXcace8RAiJmVtrGC_KLbVyt4acvixHiN=w298-h298-k-no""},{""title"":""Del propietario"",""image"":""https://lh3.googleusercontent.com/p/AF1QipNRApgAY5fwuxBGi3_odRejr0mDHfflBNvrYPYR=w224-h298-k-no""},{""title"":""Street View y 360°"",""image"":""https://streetviewpixels-pa.googleapis.com/v1/thumbnail?panoid=E6q2S_D86j8chJBeVynAXg\u0026cb_client=maps_sv.tactile.gps\u0026w=224\u0026h=298\u0026yaw=319.16455\u0026pitch=0\u0026thumbfov=100""}]",null,null,"{""link"":"""",""source"":""""}","{""id"":""118208285029922265925"",""name"":""Open House Málaga | Clínica de Análisis de ETS (propietario)"",""link"":""https://www.google.com/maps/contrib/118208285029922265925""}","{""borough"":""Distrito Centro"",""street"":""Alameda de Capuchinos, 49, Bajo"",""city"":""Málaga"",""postal_code"":""29014"",""state"":""Málaga"",""country"":""ES""}","[{""id"":""from_the_business"",""name"":""Información proporcionada por la empresa"",""options"":[{""name"":""Se identifica como de propietarias mujeres"",""enabled"":true}]},{""id"":""service_options"",""name"":""Opciones de servicio"",""options"":[{""name"":""Ofrece asistencia en otros idiomas"",""enabled"":false}]},{""id"":""accessibility"",""name"":""Accesibilidad"",""options"":[{""name"":""Acceso para sillas de ruedas"",""enabled"":true},{""name"":""Aseo adaptado para sillas de ruedas"",""enabled"":true}]},{""id"":""amenities"",""name"":""Servicios"",""options"":[{""name"":""Aseos"",""enabled"":true}]},{""id"":""crowd"",""name"":""Clientela"",""options"":[{""name"":""Amigable con la comunidad LGBTQ+"",""enabled"":true},{""name"":""Espacio seguro para personas transgénero"",""enabled"":true}]},{""id"":""planning"",""name"":""Planificación"",""options"":[{""name"":""Se necesita cita"",""enabled"":true},{""name"":""Se recomienda pedir cita"",""enabled"":true}]},{""id"":""payments"",""name"":""Pagos"",""options"":[{""name"":""Pagos con móvil vía NFC"",""enabled"":true},{""name"":""Tarjetas de crédito"",""enabled"":true},{""name"":""Tarjetas de débito"",""enabled"":true}]}]","[{""Name"":""Antonio Rivilla Marcos"",""ProfilePicture"":""https://lh3.googleusercontent.com/a/ACg8ocKBwgyYAcNzZ7pWqjo6yyi4VzlzD_ru4d0pgkTrhJNModo_Yw=s120-c-rp-mo-br100"",""Rating"":5,""Description"":""Llevo años confiando en Open House para mis chequeos rutinarios de ITS en Madrid, y siempre han sido una referencia en cuanto a profesionalidad, discreción y trato cercano. Son auténticos expertos y su atención ha sido siempre impecable.\nMe mudé a Málaga y, aunque al principio me preocupaba no poder seguir con ellos, me llevé una grata sorpresa al descubrir que habían abierto un nuevo punto de toma de muestras en la ciudad. Al principio tenía mis dudas sobre si la calidad del servicio sería la misma, pero mi experiencia ha sido excelente.\nDesde la atención telefónica, donde me explicaron con todo detalle el proceso, hasta la visita al centro, todo fue igual de profesional y cercano que en mis visitas a la clínica de Madrid. Las instalaciones están cuidadas, el personal es amable y los resultados como siempre. Me sentí totalmente acompañado y tranquilo durante todo el proceso.\nSin duda, lo recomiendo a cualquiera que busque un centro fiable y especializado en Málaga."",""Images"":null,""When"":""""}]",null,
