input_id,link,title,category,address,open_hours,popular_times,website,phone,plus_code,review_count,review_rating,reviews_per_rating,latitude,longitude,cid,status,descriptions,reviews_link,thumbnail,timezone,price_range,data_id,place_id,images,reservations,order_online,menu,owner,complete_address,about,user_reviews,user_reviews_extended,emails
92683d9a-1bf1-4c7d-8743-fae197d90613,https://www.google.com/maps/place/Autoescuela+Noctiluca/data=!4m7!3m6!1s0xd725a6fdda2034f:0xb5df7bc33c538463!8m2!3d36.716116!4d-4.286468!16s%2Fg%2F1hc7whzpn!19sChIJTwOi3W9acg0RY4RTPMN737U?authuser=0&hl=es&rclk=1,Autoescuela Noctiluca,Autoescuela,"C. la Corta, 11, 29730 Rincón de la Victoria, Málaga","{""domingo"":[""Cerrado""],""jueves"":[""10:00–13:00"",""17:00–20:00""],""lunes"":[""10:00–13:00"",""17:00–20:00""],""martes"":[""10:00–13:00"",""17:00–20:00""],""miércoles"":[""10:00–13:00"",""17:00–20:00""],""sábado"":[""Cerrado""],""viernes"":[""10:00–13:00"",""17:00–19:00""]}",{},http://www.autoescuelanoctiluca.es/,952 40 49 82,PP87+CC Rincón de la Victoria,65,4.900000,"{""1"":1,""2"":0,""3"":0,""4"":0,""5"":64}",36.716116,-4.286468,13105329519132378211,,,,https://lh3.googleusercontent.com/gps-cs-s/AHVAwer_QYOpV1tSQ5KvAFzSuHZDuAzkgXs7esmPzHcvM3SgQOsSfQXRKBYLRmO9uSJeeqb8z2zFvka86XTlVe21Z7FOd48GmLsN27H8wl1HN19lgmeOeUsebpdIStqR6HW9aRoAcB4v=w426-h240-k-no,Europe/Madrid,,0xd725a6fdda2034f:0xb5df7bc33c538463,ChIJTwOi3W9acg0RY4RTPMN737U,"[{""title"":""Todas"",""image"":""https://lh3.googleusercontent.com/gps-cs-s/AHVAwer_QYOpV1tSQ5KvAFzSuHZDuAzkgXs7esmPzHcvM3SgQOsSfQXRKBYLRmO9uSJeeqb8z2zFvka86XTlVe21Z7FOd48GmLsN27H8wl1HN19lgmeOeUsebpdIStqR6HW9aRoAcB4v=w529-h298-k-no""},{""title"":""Street View y 360°"",""image"":""https://streetviewpixels-pa.googleapis.com/v1/thumbnail?panoid=gvv4iXn3P5Nm-J7bdy0lvw\u0026cb_client=maps_sv.tactile.gps\u0026w=224\u0026h=298\u0026yaw=307.28534\u0026pitch=0\u0026thumbfov=100""}]",null,null,"{""link"":"""",""source"":""""}","{""id"":""109256421961344755810"",""name"":""Autoescuela Noctiluca (propietario)"",""link"":""https://www.google.com/maps/contrib/109256421961344755810""}","{""borough"":"""",""street"":""Autoescuela Noctiluca, C. la Corta, 11"",""city"":""Rincón de la Victoria"",""postal_code"":""29730"",""state"":""Málaga"",""country"":""ES""}","[{""id"":""service_options"",""name"":""Opciones de servicio"",""options"":[{""name"":""Clases online"",""enabled"":true}]},{""id"":""accessibility"",""name"":""Accesibilidad"",""options"":[{""name"":""Acceso para sillas de ruedas"",""enabled"":true}]},{""id"":""payments"",""name"":""Pagos"",""options"":[{""name"":""Pagos con móvil vía NFC"",""enabled"":true},{""name"":""Tarjetas de crédito"",""enabled"":true},{""name"":""Tarjetas de débito"",""enabled"":true}]}]","[{""Name"":""Miguel Sanchez Sanchez"",""ProfilePicture"":""https://lh3.googleusercontent.com/a-/ALV-UjXAX9A8r2xzO4xWguVxQ2krBpZb1Uedae-gSV2SAYsSNByNVPZO=s120-c-rp-mo-ba6-br100"",""Rating"":5,""Description"":""Excelente autoescuela con magnificos  profesionales. Preparación integral con clases y test on line. Resolución personalizada de dudas. Horarios flexibles en las clases prácticas. Gracias por todo."",""Images"":[""www.google.com/local/imagery/report/?cb_client=maps_sv.tactile\u0026image_key=!1e10!2sCIHM0ogKEICAgMCg9KqAcg\u0026fid=0x0:0xb5df7bc33c538463""],""When"":""2025-2-14""},{""Name"":""Esteban Sanchez Navarro"",""ProfilePicture"":""https://lh3.googleusercontent.com/a/ACg8ocK175YDmA04EVSYbPGDlyw2MEvqzLbwe1rZbzMohoL7l9Dw0EU=s120-c-rp-mo-br100"",""Rating"":5,""Description"":""Aprobado todo a la primera. Miguel y Encarni muy profesionales y muy buenos profesores. Recomiendo esta autoescuela sin duda"",""Images"":null,""When"":""""},{""Name"":""Mayu 343"",""ProfilePicture"":""https://lh3.googleusercontent.com/a/ACg8ocIKLdJc80DLrJ6fc1UTVnyptb_iTEafGsvq9tGy2wmJItB3XA=s120-c-rp-mo-br100"",""Rating"":5,""Description"":""Ha sido una gran autoescuela y Encarni y Miguel han sido unos grandes profesores, muy amables y profesionales 😊❤️"",""Images"":null,""When"":""""},{""Name"":""Adri"",""ProfilePicture"":""https://lh3.googleusercontent.com/a/ACg8ocKCtrl_no6_YJRgpcmH3r4BHQB8eMfykK09jv2-0l1mCM262g=s120-c-rp-mo-br100"",""Rating"":5,""Description"":""Aprobado a la primera.\nHe tenido muy buena experiencia con la autoescuela, muy buenas clases. Tanto Miguel como Encarni son muy excelentes profesionales. Recomendadisimo al 100%"",""Images"":null,""When"":""""},{""Name"":""natalia fernandez mcdonald"",""ProfilePicture"":""https://lh3.googleusercontent.com/a-/ALV-UjXUGuQruKDyPNoiFoGGfY6JHvVfP5w_XyekxoF9QSZiLCpUjRFr_g=s120-c-rp-mo-br100"",""Rating"":5,""Description"":""¡Increíble experiencia en Autoescuela Noctiluca! Después de probar varias opciones en Rincón de la Victoria, finalmente encontré una autoescuela que realmente hace la diferencia. Todo el equipo es extremadamente profesional, atento y, sobre todo, paciente.\n\nDesde el primer momento, me sentí apoyada y en confianza. Se nota que les importa realmente que aprendas y te sientas seguro al volante. Además, las explicaciones son claras y tienen mucha paciencia para resolver cualquier duda, lo que hace que el proceso de aprendizaje sea mucho más llevadero.\n\nRecomendaría Noctiluca al 100%, no solo por su profesionalismo, sino también por el ambiente positivo que crean."",""Images"":null,""When"":""""},{""Name"":""espe sanchez"",""ProfilePicture"":""https://lh3.googleusercontent.com/a/ACg8ocKYNWqM0Sm0q2kE0NeLHaZ-Z_UxPTbRxqojmiG03IGPWKLBZg=s120-c-rp-mo-br100"",""Rating"":5,""Description"":""Profesores muy buenos y amables, con una gran paciencia, estoy muy contenta con el trato recibido, gracias a ellos me he podido sacar el carnet a la primera. Muchas gracias por todo!"",""Images"":null,""When"":""""},{""Name"":""miriam gomez"",""ProfilePicture"":""https://lh3.googleusercontent.com/a-/ALV-UjULpyT3mH-ziAvFmVxsFhdyBoxtCX0_3907KE3BuU7A7R9xOZn-Kg=s120-c-rp-mo-br100"",""Rating"":5,""Description"":""Recomendada 100%, tanto en buen trato, como en confianza, clases agradables y amenas con Encarni , muy buena profesora!! Miguel, en la oficina muy amable y súper atento, no me puedo quedar más contenta, aprobada a la primera!! Al principio no lo tenía muy claro pero vale la pena sin duda."",""Images"":null,""When"":""""},{""Name"":""mariopgk28"",""ProfilePicture"":""https://lh3.googleusercontent.com/a/ACg8ocI1oFfVofHnMopjkCnkHtiWKNC49yWbAhPN3RYwKCotax8iy4Q=s120-c-rp-mo-br100"",""Rating"":5,""Description"":""Excelente autoescuela, muy buen trato y confianza, gente muy encantadora. Tienen muchos recursos didácticos, estoy contento de haberla elegido, la recomiendo a todo el mundo.😁"",""Images"":null,""When"":""""}]",null,
92683d9a-1bf1-4c7d-8743-fae197d90613,https://www.google.com/maps/place/El+Pol%C3%ADgrafo+M%C3%A1laga/data=!4m7!3m6!1s0xd725bbcb73ad787:0x3e1b11966296ebf!8m2!3d36.7146902!4d-4.3115243!16s%2Fg%2F11ry08_k9t!19sChIJh9c6t7xbcg0Rv24pZhmx4QM?authuser=0&hl=es&rclk=1,El Polígrafo Málaga,Psicólogo,"C. la Huerta, 29720 La Cala del Moral, Málaga",{},{},https://elpoligrafo.es/,603 41 36 93,PM7Q+V9 La Cala del Moral,17,5.000000,"{""1"":0,""2"":0,""3"":0,""4"":0,""5"":17}",36.714690,-4.311524,279699374519971519,,,,https://lh3.googleusercontent.com/p/AF1QipOYA1TSTJQzBu5tkNN5geWImHZzHIJIXGRPNW_Z=w408-h272-k-no,Europe/Madrid,,0xd725bbcb73ad787:0x3e1b11966296ebf,ChIJh9c6t7xbcg0Rv24pZhmx4QM,"[{""title"":""Todas"",""image"":""https://lh3.googleusercontent.com/p/AF1QipOYA1TSTJQzBu5tkNN5geWImHZzHIJIXGRPNW_Z=w446-h298-k-no""},{""title"":""Del propietario"",""image"":""https://lh3.googleusercontent.com/p/AF1QipNkcXAU4pgH0AKVuFftv6PIGMQqRz5DVylfsO9P=w529-h298-k-no""},{""title"":""Vídeos"",""image"":""https://lh3.googleusercontent.com/p/AF1QipNkcXAU4pgH0AKVuFftv6PIGMQqRz5DVylfsO9P=w529-h298-k-no""},{""title"":""Street View y 360°"",""image"":""https://streetviewpixels-pa.googleapis.com/v1/thumbnail?panoid=N12K2grj2h0wdjQEdsW_2Q\u0026cb_client=maps_sv.tactile.gps\u0026w=224\u0026h=298\u0026yaw=112.76073\u0026pitch=0\u0026thumbfov=100""}]",null,null,"{""link"":"""",""source"":""""}","{""id"":""110324446161543848448"",""name"":""El Polígrafo Málaga (propietario)"",""link"":""https://www.google.com/maps/contrib/110324446161543848448""}","{""borough"":"""",""street"":""C. la Huerta"",""city"":""La Cala del Moral"",""postal_code"":""29720"",""state"":""Málaga"",""country"":""ES""}","[{""id"":""accessibility"",""name"":""Accesibilidad"",""options"":[{""name"":""Acceso para sillas de ruedas"",""enabled"":true},{""name"":""Aseo adaptado para sillas de ruedas"",""enabled"":true}]},{""id"":""amenities"",""name"":""Servicios"",""options"":[{""name"":""Aseos"",""enabled"":true}]},{""id"":""planning"",""name"":""Planificación"",""options"":[{""name"":""Se recomienda pedir cita"",""enabled"":true}]}]","[{""Name"":""Manuel Duarte"",""ProfilePicture"":""https://lh3.googleusercontent.com/a-/ALV-UjVdsbVvu19tOKDQxe1Ki40yMbslhVC7XaE-demmqqKg4ELhLQh0=s120-c-rp-mo-br100"",""Rating"":5,""Description"":""El trato es excelente y los resultados perfectos, estamos encantados con el servicio, gracias Fernando"",""Images"":null,""When"":""""},{""Name"":""Juan Pirillo"",""ProfilePicture"":""https://lh3.googleusercontent.com/a/ACg8ocI4XUYSz7WfORwJCW9lgDZTx7AEqgF5TBM16Vq0n5Xg1YZe0w=s120-c-rp-mo-br100"",""Rating"":5,""Description"":""Gran servicio y todo en orden, con un apoyo muy grande por parte del profesional, es un experto en lo que hace y se nota, antes de tomar decisiones precipitadas acudir . Gracias Fernando"",""Images"":null,""When"":""""},{""Name"":""Patricio Jaime"",""ProfilePicture"":""https://lh3.googleusercontent.com/a-/ALV-UjUbDVEPoWe5sy3Uk6W6Dw_Xdwv9WDQmkKmBOGn6vQnKbynt8Rsq=s120-c-rp-mo-ba3-br100"",""Rating"":5,""Description"":""Gran profesional, gran padre y lo una gran persona. Muy contento con el resultado y las recomendaciones. No dudaré en recomendarlo y ojalá no necesite volver y si vuelvo será para otros servicios. Gracias Fernando."",""Images"":null,""When"":""""},{""Name"":""Ivan Broklyn"",""ProfilePicture"":""https://lh3.googleusercontent.com/a-/ALV-UjXb6UvCplo_prucRVySuPJRfheP9qO6sITFWCLRVoGtMiJ7ZVE=s120-c-rp-mo-br100"",""Rating"":5,""Description"":""Buen trato, buen ambiente, nos trato genial, con confianza y profesionalidad, lo recomiendo."",""Images"":null,""When"":""""},{""Name"":""María Jose Cordoba Pineda"",""ProfilePicture"":""https://lh3.googleusercontent.com/a/ACg8ocKLKokenIU5tZR2q9jpFE7JhvVQd4J-tt0R3-Bu-do5qizZRQ=s120-c-rp-mo-br100"",""Rating"":5,""Description"":""Me sentí muy cómoda, todo muy bien explicado y resultados acordes a lo previsto. Excelente profesional. Lo recomiendo."",""Images"":null,""When"":""""},{""Name"":""OTM. ferias"",""ProfilePicture"":""https://lh3.googleusercontent.com/a-/ALV-UjUZKqLjavqu739dXz6TlSvmg3lNeMbzUfoPLn5qBjo7fL9OhlGD=s120-c-rp-mo-ba5-br100"",""Rating"":5,""Description"":""El servicio es excelente. Son profesionales los que lo realizan. Ofrece total garantía en los resultados. El precio es razonable.\nA mi me ayudaron mucho. Lo recomiendo."",""Images"":null,""When"":""""},{""Name"":""Vanesa Cabrerizo"",""ProfilePicture"":""https://lh3.googleusercontent.com/a-/ALV-UjWv9A88gS-QKaIUwMfTDEUi_9SC5n4RQxdTwnT6FWKabwUYYPPAtQ=s120-c-rp-mo-br100"",""Rating"":5,""Description"":""Muy buen trato, recomendable 100%"",""Images"":null,""When"":""""},{""Name"":""María José Sánchez"",""ProfilePicture"":""https://lh3.googleusercontent.com/a/ACg8ocIcWw5HqYV9VHGb7VHLNWrlH-S2Q9PWOTa6QT7vLD37ob9byw=s120-c-rp-mo-br100"",""Rating"":5,""Description"":""Servicio impecable .\nUn gran profesional .\nSúper recomendable"",""Images"":null,""When"":""""}]",null,
92683d9a-1bf1-4c7d-8743-fae197d90613,https://www.google.com/maps/place/Test+Empresa/data=!4m7!3m6!1s0xd7259ce67db4527:0xe0a1bbf58ecf0490!8m2!3d36.7239118!4d-4.3822646!16s%2Fg%2F11yy1155kt!19sChIJJ0XbZ85Zcg0RkATPjvW7oeA?authuser=0&hl=es&rclk=1,Test Empresa,,"P.º Cerrado de Calderón, Málaga-Este, 29018 Málaga",{},{},,,,0,0.000000,"{""1"":0,""2"":0,""3"":0,""4"":0,""5"":0}",36.723912,-4.382265,16186425199083586704,,,,,Europe/Madrid,,0xd7259ce67db4527:0xe0a1bbf58ecf0490,ChIJJ0XbZ85Zcg0RkATPjvW7oeA,[],null,null,"{""link"":"""",""source"":""""}","{""id"":"""",""name"":""Test Empresa (propietario)"",""link"":""""}","{""borough"":"""",""street"":"""",""city"":"""",""postal_code"":"""",""state"":"""",""country"":""""}",null,[],null,
92683d9a-1bf1-4c7d-8743-fae197d90613,https://www.google.com/maps/place/Laboratorio+Bioclon/data=!4m7!3m6!1s0xd7259cece3861a7:0xd78fdb3f04e30605!8m2!3d36.7210084!4d-4.3578068!16s%2Fg%2F1tg_hdk9!19sChIJp2E4zs5Zcg0RBQbjBD_bj9c?authuser=0&hl=es&rclk=1,Laboratorio Bioclon,Laboratorio de análisis clínicos,"Edf El Carmen, C. Almería, 17, Of I- 3 , I, Málaga-Este, 29017 4, Málaga","{""domingo"":[""Cerrado""],""jueves"":[""8:00–16:00""],""lunes"":[""Abierto 24 horas""],""martes"":[""8:00–16:00""],""miércoles"":[""8:00–16:00""],""sábado"":[""Cerrado""],""viernes"":[""8:00–16:00""]}",{},https://bioclon.es/,952 29 46 28,PJCR+CV Málaga,75,4.000000,"{""1"":17,""2"":1,""3"":1,""4"":1,""5"":55}",36.721008,-4.357807,15532874703535539717,,,,https://lh3.googleusercontent.com/gps-cs-s/AHVAwerXCRt8VLd13QwGhSoXCTbu89cutTFsRvYAq92u-pjRSe88jT6dx6ryVIzh-V6IkUOvZOCkpB-qF_uOGtMzfnXwraDzKQn2yXZcSgKJ7sFw4NnMjTzPcE6cG93LHFY4_C204fiJrA=w408-h306-k-no,Europe/Madrid,,0xd7259cece3861a7:0xd78fdb3f04e30605,ChIJp2E4zs5Zcg0RBQbjBD_bj9c,"[{""title"":""Todas"",""image"":""https://lh3.googleusercontent.com/gps-cs-s/AHVAwerXCRt8VLd13QwGhSoXCTbu89cutTFsRvYAq92u-pjRSe88jT6dx6ryVIzh-V6IkUOvZOCkpB-qF_uOGtMzfnXwraDzKQn2yXZcSgKJ7sFw4NnMjTzPcE6cG93LHFY4_C204fiJrA=w397-h298-k-no""},{""title"":""Street View y 360°"",""image"":""https://streetviewpixels-pa.googleapis.com/v1/thumbnail?panoid=v6zPkjURhtkz807Gl4JSRQ\u0026cb_client=maps_sv.tactile.gps\u0026w=224\u0026h=298\u0026yaw=334.13022\u0026pitch=0\u0026thumbfov=100""}]",null,null,"{""link"":"""",""source"":""""}","{""id"":""115998382896885996487"",""name"":""Laboratorio Bioclon (propietario)"",""link"":""https://www.google.com/maps/contrib/115998382896885996487""}","{""borough"":""Málaga-Este"",""street"":""Edf El Carmen, C. Almería, 17, Of I- 3 , I"",""city"":""4"",""postal_code"":""29017"",""state"":""Málaga"",""country"":""ES""}","[{""id"":""service_options"",""name"":""Opciones de servicio"",""options"":[{""name"":""Ofrece asistencia en otros idiomas"",""enabled"":false}]},{""id"":""accessibility"",""name"":""Accesibilidad"",""options"":[{""name"":""Acceso para sillas de ruedas"",""enabled"":false},{""name"":""Aparcamiento adaptado para sillas de ruedas"",""enabled"":false},{""name"":""Aseo adaptado para sillas de ruedas"",""enabled"":false},{""name"":""Asientos adaptados sillas de ruedas"",""enabled"":false},{""name"":""Bucle magnético asistencial"",""enabled"":false}]},{""id"":""amenities"",""name"":""Servicios"",""options"":[{""name"":""Aseos"",""enabled"":true},{""name"":""Aseos unisex"",""enabled"":true}]},{""id"":""crowd"",""name"":""Clientela"",""options"":[{""name"":""Amigable con la comunidad LGBTQ+"",""enabled"":true},{""name"":""Espacio seguro para personas transgénero"",""enabled"":true}]},{""id"":""planning"",""name"":""Planificación"",""options"":[{""name"":""Se necesita cita"",""enabled"":true},{""name"":""Se recomienda pedir cita"",""enabled"":true}]},{""id"":""payments"",""name"":""Pagos"",""options"":[{""name"":""Pagos con móvil vía NFC"",""enabled"":true},{""name"":""Tarjetas de crédito"",""enabled"":true},{""name"":""Tarjetas de débito"",""enabled"":true},{""name"":""Tarjetas de crédito"",""enabled"":false}]}]","[{""Name"":""Cristina Páez"",""ProfilePicture"":""https://lh3.googleusercontent.com/a/ACg8ocKMxRV4QBC9XvM_NtyimogaEeW9yNRkmJhYsv369LHSvQJZKw=s120-c-rp-mo-ba3-br100"",""Rating"":5,""Description"":""Recomiendo este laboratorio 100%. Súper accesibles cada vez que he llamado, y han sido encantadores cuando he ido. Los resultados de las pruebas las he obtenido muy rápido también. Mil gracias por todo :)"",""Images"":null,""When"":""""},{""Name"":""María Antonella Gallo"",""ProfilePicture"":""https://lh3.googleusercontent.com/a-/ALV-UjUqSTIBMyOcI2QWlPT18fp63eJ1eRgQSzTAddW9-HzjOetNRX2U8A=s120-c-rp-mo-ba2-br100"",""Rating"":5,""Description"":""Fuimos hoy a hacernos los pcr para volver a Argentina. Llamamos a las 8:30 y nos dieron turno 9:30hs. Nos lo hicimos mi pareja y yo. Super profesional y muy amable la chica que nos atendió (no recuerdo el nombre pero tiene rulos). El resultado nos lo dieron en 2:15hs para el pcr rápido. Nos costó 85€ cada uno, podes pagar en efectivo o tarjeta, amex no te toma, visa si. Lo recomiendo! Lugar muy limpio y bonito. Algo importante, la chica fue muy gentil cuando te hisopan la nariz! Nos tocó cada bestia en mi país! Así que dato a destacar. Saludos!"",""Images"":[""www.google.com/local/imagery/report/?cb_client=maps_sv.tactile\u0026image_key=!1e10!2sCIHM0ogKEICAgICG-o_1sgE\u0026fid=0x0:0xd78fdb3f04e30605""],""When"":""2021-10-27""},{""Name"":""Mayte Castillo Molina"",""ProfilePicture"":""https://lh3.googleusercontent.com/a/ACg8ocKfdZ6dEfrb7cf_KKJDvb1djfSqTA0147jH_4Uf1p_My2EcMA=s120-c-rp-mo-ba2-br100"",""Rating"":5,""Description"":""Recomiendo este laboratorio 100 x 100,el trato ha sido maravilloso con mucho cariño y confianza,me hice una analitica de tiroides,y no me dolio nada la extracción lo hizo con mucho cuidado y cariño,me la hice el viernes que pillaba el fin de semana y hoy mismo lunes me han dado los resultados,para cual quier cosa que necesite sin duda volveré con estos grandes profesionales, gracias por todo"",""Images"":null,""When"":""""},{""Name"":""Nani Poves"",""ProfilePicture"":""https://lh3.googleusercontent.com/a-/ALV-UjUPHqdgBKL91G13FEnGIp_SOLqZ63f89x2eV705eYfDoJVXnCdonw=s120-c-rp-mo-ba4-br100"",""Rating"":5,""Description"":""Maravilloso trato, interés por mi problema, solución la mejor para mi, y mucho cariño de las tres hacia mi. Un laboratorio donde piensan más en ti, que en su interés.De corazón gracias…..❤️❤️"",""Images"":null,""When"":""""},{""Name"":""Maria Travaglini"",""ProfilePicture"":""https://lh3.googleusercontent.com/a/ACg8ocJulgzd9cm1Lk0DMfQtaudhzSJjNFIKdreYIvxLBs026OldoQ=s120-c-rp-mo-ba2-br100"",""Rating"":5,""Description"":""Llevo más de 10 años yendo al laboratorio para análisis. Todo el personal tiene un trato muy amable y son rápidos en darte los resultados. verdaderos profesionales"",""Images"":null,""When"":""""},{""Name"":""Marta dap"",""ProfilePicture"":""https://lh3.googleusercontent.com/a/ACg8ocKaZ8zX5zdigLX3pe6L94PTDyNXuPF4XTpp0SwQfPb2hORZ4Q=s120-c-rp-mo-ba2-br100"",""Rating"":1,""Description"":""He ido hoy a sacarme sangre, llevo años yendo allí por cercanía y porque Lucia era una profesional 10. Me sacaba sangre rápido y sin dolor.\nLa anterior vez no me fue muy mal.\nPero hoy tengo los dos brazos doloridos, con moratones, además de hacerme bastante daño, no sabia encontrarme la vena bien.\nEntiendo que es complicado sacar sangre, pero que una chica este sacando sangre durante todo un día y no tenga facilidad para ello.....\nNo se que ha pasado con Lucia pero espero que la próxima vez que vaya sea mejor experiencia que hoy.\nUn saludo"",""Images"":null,""When"":""""},{""Name"":""Carmen Moya Cruz"",""ProfilePicture"":""https://lh3.googleusercontent.com/a/ACg8ocK-94AKtYIZuvAHeRNpbrCrbx2gm6BV68w2C_G75EAjovVbEw=s120-c-rp-mo-ba3-br100"",""Rating"":5,""Description"":""Salgo encantada de este lugar cada vez que necesito realizarme alguna extracción. Profesionalidad, puntualidad y buen trato. Todos los chicos incluidos los de prácticas son muy competentes.\nSiempre recomendaré esta clínica. Gracias"",""Images"":null,""When"":""""},{""Name"":""Alvarez Pablo EDF 21"",""ProfilePicture"":""https://lh3.googleusercontent.com/a-/ALV-UjUiJSAnnS0QS2c7gtzXYwzpeGyIAED8NDe9FXnOILaB_0ppuRw=s120-c-rp-mo-br100"",""Rating"":5,""Description"":""Trato de 10, Fui a sacarme sangre y me atendieron al instante. Todas las veces que he venido he recibido un trato excelente por parte de las chicas, sobre todo de la chica de rizos que siempre me ayuda con el abanico."",""Images"":null,""When"":""""}]",null,
