input_id,link,title,category,address,open_hours,popular_times,website,phone,plus_code,review_count,review_rating,reviews_per_rating,latitude,longitude,cid,status,descriptions,reviews_link,thumbnail,timezone,price_range,data_id,place_id,images,reservations,order_online,menu,owner,complete_address,about,user_reviews,user_reviews_extended,emails
92683d9a-1bf1-4c7d-8743-fae197d90613,https://www.google.com/maps/place/The+Test+-+Cl%C3%ADnica+de+Salud+Masculina/data=!4m7!3m6!1s0xd72f7e4b71122bb:0x16b92a8b641e8ac6!8m2!3d36.7166023!4d-4.4314063!16s%2Fg%2F11vc0t8dqt!19sChIJuyIRt-T3cg0RxooeZIsquRY?authuser=0&hl=es&rclk=1,The Test - Clínica de Salud Masculina,Clínica andrológica,"Av. de Andalucía, 13, Distrito Centro, 29002 Málaga","{""domingo"":[""Cerrado""],""jueves"":[""9:00–21:00""],""lunes"":[""9:00–21:00""],""martes"":[""9:00–21:00""],""miércoles"":[""9:00–21:00""],""sábado"":[""Cerrado""],""viernes"":[""9:00–21:00""]}",{},https://thetest.es/,951 82 95 42,PH89+JC Málaga,16,4.100000,"{""1"":3,""2"":1,""3"":0,""4"":0,""5"":12}",36.716602,-4.431406,1637386717694429894,,,,https://lh3.googleusercontent.com/p/AF1QipM8zqpWmpSmPMyUFZkNO_DootEBaydjB1H_bM5h=w408-h306-k-no,Europe/Madrid,,0xd72f7e4b71122bb:0x16b92a8b641e8ac6,ChIJuyIRt-T3cg0RxooeZIsquRY,"[{""title"":""Todas"",""image"":""https://lh3.googleusercontent.com/p/AF1QipM8zqpWmpSmPMyUFZkNO_DootEBaydjB1H_bM5h=w397-h298-k-no""},{""title"":""Del propietario"",""image"":""https://lh3.googleusercontent.com/p/AF1QipMYNQuaAbyMNke4RP5vrz8IVrOCGocYTHmKvLLZ=w397-h298-k-no""},{""title"":""Street View y 360°"",""image"":""https://streetviewpixels-pa.googleapis.com/v1/thumbnail?panoid=SxnaMs-jkU1_p0yKdwk3cw\u0026cb_client=maps_sv.tactile.gps\u0026w=224\u0026h=298\u0026yaw=190.19925\u0026pitch=0\u0026thumbfov=100""}]",null,null,"{""link"":"""",""source"":""""}","{""id"":""111019221666657331698"",""name"":""The Test - Clínica de Salud Masculina (propietario)"",""link"":""https://www.google.com/maps/contrib/111019221666657331698""}","{""borough"":""Distrito Centro"",""street"":""Av. de Andalucía, 13"",""city"":""Málaga"",""postal_code"":""29002"",""state"":""Málaga"",""country"":""ES""}","[{""id"":""accessibility"",""name"":""Accesibilidad"",""options"":[{""name"":""Acceso para sillas de ruedas"",""enabled"":true},{""name"":""Aseo adaptado para sillas de ruedas"",""enabled"":true}]},{""id"":""amenities"",""name"":""Servicios"",""options"":[{""name"":""Aseos"",""enabled"":true}]},{""id"":""crowd"",""name"":""Clientela"",""options"":[{""name"":""Amigable con la comunidad LGBTQ+"",""enabled"":true},{""name"":""Espacio seguro para personas transgénero"",""enabled"":true}]},{""id"":""planning"",""name"":""Planificación"",""options"":[{""name"":""Se recomienda pedir cita"",""enabled"":true}]},{""id"":""payments"",""name"":""Pagos"",""options"":[{""name"":""Pagos con móvil vía NFC"",""enabled"":true},{""name"":""Tarjetas de crédito"",""enabled"":true},{""name"":""Tarjetas de débito"",""enabled"":true}]}]","[{""Name"":""Dimitar Miriyski"",""ProfilePicture"":""https://lh3.googleusercontent.com/a/ACg8ocL8-ClCnRf9P-s7m9v28gM-hKs034-xv9vjrrUtlBOIJbbZDQ=s120-c-rp-mo-ba5-br100"",""Rating"":2,""Description"":""Te mandan por otro laboratorio por los análisis. Dicen que no se espera nada, después de preguntar dos veces porqué tuve horario liado este día. Llegó a la laboratorio, digo que me han dicho y del laboratorio me dicen que saco número, cogo cola y espero todo el mundo. No es correcto...."",""Images"":null,""When"":""""},{""Name"":""Juan Carlos MJ"",""ProfilePicture"":""https://lh3.googleusercontent.com/a-/ALV-UjVpCSX8Tec5nOCH1NPF7Jzu_sQEL2yJr-RqmANDO2XFuQsH2pKCNg=s120-c-rp-mo-ba3-br100"",""Rating"":1,""Description"":""El tratamientos de ondas de choque no vale para nada , bueno sí, para tirar 1000€ …no recomiendo esta clinica"",""Images"":null,""When"":""""},{""Name"":""Pedro Jose Perez Lopez"",""ProfilePicture"":""https://lh3.googleusercontent.com/a-/ALV-UjWz-4U5JKWmjXPNb9T63bYNneJX7cyR6FX8R0fprXJhu8DMh_c=s120-c-rp-mo-br100"",""Rating"":5,""Description"":""Estoy muy satisfecho del trato que estoy recibiendo por el tratamiento que estoy siguiendo.\nMuy buenos profesionales y muy atentos."",""Images"":[""www.google.com/local/imagery/report/?cb_client=maps_sv.tactile\u0026image_key=!1e10!2sCIHM0ogKEICAgID96oevJw\u0026fid=0x0:0x16b92a8b641e8ac6""],""When"":""2024-3-15""},{""Name"":""Jose"",""ProfilePicture"":""https://lh3.googleusercontent.com/a-/ALV-UjVBrpBylKHR2wD5ZO69ui7GNxVwiQwloXuLTyHEHL-bWlOJGfFE4g=s120-c-rp-mo-br100"",""Rating"":5,""Description"":""Buenas yo no quiero convencer a nadie de nada, dejando esto claro, cuento mi experiencia.Es la primera reseña q mandó, tengo 51 años y trabajo en la construcción y tenía todo el reparo de ir a la clínica a que me aconsejaran de mi problema.Hoy en día solo me arrepiento de no a ver ido antes,me han cambiado la vida.Buena gente y profesionales.Ahora aquí está el TIO.Gracias equipo"",""Images"":null,""When"":""""},{""Name"":""jose manuel izquierdo alperi"",""ProfilePicture"":""https://lh3.googleusercontent.com/a-/ALV-UjUXvpL6Q1PN5d_ZmriSvCT2X8mRfnYyQ0M4hSKlgKhdOEOI3b0c=s120-c-rp-mo-ba4-br100"",""Rating"":5,""Description"":""Clínica llena de profesionales donde se trata a los pacientes de una forma increíble y la experiencia es 100% recomendable. Sin lugar a duda temas tan importantes y serios no pueden delegarse en cualquier profesional por eso elegí esta clínica malagueña."",""Images"":null,""When"":""""},{""Name"":""Trotark Har"",""ProfilePicture"":""https://lh3.googleusercontent.com/a-/ALV-UjVNEQDTh4cpyKRjZ3kTjP3y2YUJyG4sOk9F84_1yvbUtpi2C0lK=s120-c-rp-mo-ba3-br100"",""Rating"":5,""Description"":""Increíble experiencia... profesionales tratando un tema delicado y efectividad del 100% en mi caso... Muy contento"",""Images"":null,""When"":""""},{""Name"":""Cristo Supervielle"",""ProfilePicture"":""https://lh3.googleusercontent.com/a/ACg8ocI2xbRJtDgLvQsfBv7-Bvota6IIOakrgaMzwWBt3aGsmOFsrDs=s120-c-rp-mo-br100"",""Rating"":5,""Description"":""Una experiencia muy buena, 100% recomendable. Mis problemas se han ido, vuelvo a confiar. Gracias al equipo"",""Images"":null,""When"":""""},{""Name"":""Ricardo Gomez"",""ProfilePicture"":""https://lh3.googleusercontent.com/a/ACg8ocJ07TpBjmpX2cAqZCXr3pXx0g_U9nFpdfzID6twGo88x-Y8WQ=s120-c-rp-mo-br100"",""Rating"":5,""Description"":""Maravilloso atención y comprensión sobre la situación recomiendo ir y dejar de lado los prejuicios a mí me ha cambiado la vida 😍"",""Images"":null,""When"":""""}]",null,
92683d9a-1bf1-4c7d-8743-fae197d90613,https://www.google.com/maps/place/Test+de+Alcoholismo+M%C3%A1laga/data=!4m7!3m6!1s0xd72f7d7bb724a89:0xde6c2c77c58d6b73!8m2!3d36.7137671!4d-4.4397731!16s%2Fg%2F11fpqqlvtq!19sChIJiUpyu9f3cg0Rc2uNxXcsbN4?authuser=0&hl=es&rclk=1,Test de Alcoholismo Málaga,Centro de rehabilitación,"C. Horacio Lengo, 16, Entreplanta, Oficina 3, Cruz de Humilladero, 29006 Málaga","{""domingo"":[""Cerrado""],""jueves"":[""8:00–20:00""],""lunes"":[""8:00–20:00""],""martes"":[""8:00–20:00""],""miércoles"":[""8:00–20:00""],""sábado"":[""Cerrado""],""viernes"":[""8:00–20:00""]}",{},,951 57 72 79,PH76+G3 Málaga,0,0.000000,"{""1"":0,""2"":0,""3"":0,""4"":0,""5"":0}",36.713767,-4.439773,16027234066831862643,,,,https://streetviewpixels-pa.googleapis.com/v1/thumbnail?panoid=rRuTL7IffOUM7RUHEz2hPg&cb_client=search.gws-prod.gps&w=408&h=240&yaw=84.610275&pitch=0&thumbfov=100,Europe/Madrid,,0xd72f7d7bb724a89:0xde6c2c77c58d6b73,ChIJiUpyu9f3cg0Rc2uNxXcsbN4,"[{""title"":""Todas"",""image"":""https://streetviewpixels-pa.googleapis.com/v1/thumbnail?panoid=rRuTL7IffOUM7RUHEz2hPg\u0026cb_client=maps_sv.tactile.gps\u0026w=224\u0026h=298\u0026yaw=84.610275\u0026pitch=0\u0026thumbfov=100""},{""title"":""Street View y 360°"",""image"":""https://streetviewpixels-pa.googleapis.com/v1/thumbnail?panoid=rRuTL7IffOUM7RUHEz2hPg\u0026cb_client=maps_sv.tactile.gps\u0026w=224\u0026h=298\u0026yaw=84.610275\u0026pitch=0\u0026thumbfov=100""}]",null,null,"{""link"":"""",""source"":""""}","{""id"":"""",""name"":""Test de Alcoholismo Málaga (propietario)"",""link"":""""}","{""borough"":""Cruz de Humilladero"",""street"":""C. Horacio Lengo, 16, Entreplanta, Oficina 3"",""city"":""Málaga"",""postal_code"":""29006"",""state"":""Málaga"",""country"":""ES""}","[{""id"":""accessibility"",""name"":""Accesibilidad"",""options"":[{""name"":""Acceso para sillas de ruedas"",""enabled"":true}]}]",[],null,
92683d9a-1bf1-4c7d-8743-fae197d90613,https://www.google.com/maps/place/Estaci%C3%B3n+ITV+M%C3%A1laga-El+Palo+-+VEIASA/data=!4m7!3m6!1s0xd7259b844c5c5c9:0x30c03ac2e3ce981e!8m2!3d36.7261281!4d-4.3448927!16s%2Fg%2F12cnpcwvq!19sChIJycXFRLhZcg0RHpjO48I6wDA?authuser=0&hl=es&rclk=1,Estación ITV Málaga-El Palo - VEIASA,Inspección técnica de vehículos,"C. Escritor Fuentes y Cerda, 2, Málaga-Este, 29197 Málaga","{""domingo"":[""Cerrado""],""jueves"":[""6:45–20:15""],""lunes"":[""6:45–20:15""],""martes"":[""6:45–20:15""],""miércoles"":[""6:45–20:15""],""sábado"":[""7:45–12:45""],""viernes"":[""6:45–20:15""]}","{""Friday"":{""10"":85,""11"":96,""12"":98,""13"":100,""14"":91,""15"":87,""16"":89,""17"":90,""18"":86,""19"":68,""20"":41,""21"":0,""22"":0,""5"":0,""6"":35,""7"":62,""8"":76,""9"":82},""Monday"":{""10"":77,""11"":74,""12"":75,""13"":67,""14"":65,""15"":59,""16"":64,""17"":70,""18"":75,""19"":56,""20"":33,""21"":0,""22"":0,""5"":0,""6"":28,""7"":46,""8"":63,""9"":69},""Saturday"":{""10"":52,""11"":48,""12"":33,""13"":0,""14"":0,""15"":0,""16"":0,""17"":0,""18"":0,""19"":0,""20"":0,""21"":0,""22"":0,""23"":0,""6"":0,""7"":29,""8"":44,""9"":51},""Sunday"":{},""Thursday"":{""10"":68,""11"":74,""12"":84,""13"":80,""14"":72,""15"":67,""16"":65,""17"":72,""18"":77,""19"":60,""20"":39,""21"":0,""22"":0,""5"":0,""6"":20,""7"":38,""8"":55,""9"":61},""Tuesday"":{""10"":72,""11"":80,""12"":84,""13"":84,""14"":80,""15"":74,""16"":76,""17"":84,""18"":82,""19"":67,""20"":42,""21"":0,""22"":0,""5"":0,""6"":24,""7"":44,""8"":54,""9"":62},""Wednesday"":{""10"":80,""11"":88,""12"":84,""13"":79,""14"":80,""15"":75,""16"":76,""17"":74,""18"":76,""19"":62,""20"":36,""21"":0,""22"":0,""5"":0,""6"":24,""7"":41,""8"":54,""9"":69}}",http://www.veiasa.es/,951 77 00 97,PMG4+F2 Málaga,3197,4.100000,"{""1"":309,""2"":85,""3"":339,""4"":718,""5"":1746}",36.726128,-4.344893,3512872318069020702,,,,https://lh3.googleusercontent.com/gps-cs-s/AHVAweoCyJmcVI9PHPQD56s6IrIUKck6qfd3J5WEGTsb8hpkuyToOCY-Qlr_k7tydK4IYVX54rBahtECXxKQ67H0LD9xCtv4DOQqxvLpGiaZN9J6IHTngi3E49fzE_j5bkH8iyOSG5MdNt_H_Iq2=w408-h306-k-no,Europe/Madrid,,0xd7259b844c5c5c9:0x30c03ac2e3ce981e,ChIJycXFRLhZcg0RHpjO48I6wDA,"[{""title"":""Todas"",""image"":""https://lh3.googleusercontent.com/gps-cs-s/AHVAweoCyJmcVI9PHPQD56s6IrIUKck6qfd3J5WEGTsb8hpkuyToOCY-Qlr_k7tydK4IYVX54rBahtECXxKQ67H0LD9xCtv4DOQqxvLpGiaZN9J6IHTngi3E49fzE_j5bkH8iyOSG5MdNt_H_Iq2=w397-h298-k-no""},{""title"":""Más recientes"",""image"":""https://lh3.googleusercontent.com/gps-cs-s/AHVAweoVGtxBgyTHXRlW_bAOAond2Y8pPE2MXusEUow0R2Wd6dFjZYu6rn36WDhjVYc84I_c7Wg635eQTkHtIYvP9WWSlmH5n9ZTOX3ixghgPbRKa_cC_WO1WFNw1HaNCWbWRh0xv0YN0PD1gTZS=w395-h298-k-no""},{""title"":""Vídeos"",""image"":""https://lh3.googleusercontent.com/gps-cs-s/AHVAwepXKUrUHh3elCeA1gZyR2cOWNO7rDqqRlKsfKKWMiSiTYI9eiPv3tvqMekrDKnGiX4EzMlYmcDne2Xroxf137MfWWO_wAtKV9hXRdZTmOJexvUNoo2sk3ucqC8_xSZrb6H1KYhQvA=w529-h298-k-no""},{""title"":""Exterior"",""image"":""https://lh3.googleusercontent.com/gps-cs-s/AHVAweqmc1PrwokufrstAfUuEs9Q2MW0V7PnKTtTNiAMnPnqD5mF4HcAkmoHQydAZsWqTSYHVuLB6kZjMGRrQbh-UhNq8tqBUV5ZwCi9o5Np-3SqdE9huXqwnH37Cdcc1anN98aU8c1iig=w397-h298-k-no""},{""title"":""Interior"",""image"":""https://lh3.googleusercontent.com/gps-cs-s/AHVAwep17p2-u5MgQSHrfvHZlTxFeutCvW_0zMBXpZ2GpLqihmSYSdfSFGeNRhqu2hpJ6bDVV0O_ZbOLVM-qeA6WSv40SGurlMQN-hXrtyzvaTvYcG4OSsvbccpsFuxGKApiydv1mP3dxA=w397-h298-k-no""},{""title"":""Street View y 360°"",""image"":""https://streetviewpixels-pa.googleapis.com/v1/thumbnail?panoid=qfZA5xP2LyMfYRqHuzdWBg\u0026cb_client=maps_sv.tactile.gps\u0026w=224\u0026h=298\u0026yaw=156.95029\u0026pitch=0\u0026thumbfov=100""}]",null,null,"{""link"":"""",""source"":""""}","{""id"":""102735127642873479639"",""name"":""Estación ITV Málaga-El Palo - VEIASA (propietario)"",""link"":""https://www.google.com/maps/contrib/102735127642873479639""}","{""borough"":""Málaga-Este"",""street"":""C. Escritor Fuentes y Cerda, 2"",""city"":""Málaga"",""postal_code"":""29197"",""state"":""Málaga"",""country"":""ES""}","[{""id"":""accessibility"",""name"":""Accesibilidad"",""options"":[{""name"":""Acceso para sillas de ruedas"",""enabled"":true},{""name"":""Aparcamiento adaptado para sillas de ruedas"",""enabled"":true}]},{""id"":""payments"",""name"":""Pagos"",""options"":[{""name"":""Pagos con móvil vía NFC"",""enabled"":true},{""name"":""Tarjetas de crédito"",""enabled"":true},{""name"":""Tarjetas de débito"",""enabled"":true},{""name"":""Tarjetas de crédito"",""enabled"":false}]}]","[{""Name"":""Juan Correa Madrona"",""ProfilePicture"":""https://lh3.googleusercontent.com/a-/ALV-UjUa7KH1PHtB7_pBFix_i1ed7Kp5XIYORLqGwIMUGOtoB4jaimzc=s120-c-rp-mo-ba5-br100"",""Rating"":3,""Description"":""Fui a pasar la ITV en ITV El Palo con cita a las 7:55, es decir, a primera hora de la mañana. Sorprendentemente, ya a esa hora entré con más de media hora de retraso, lo cual resulta difícil de justificar.\n\nQuiero dejar claro que el personal de inspección fue correcto, profesional y con buen trato. La crítica no va dirigida a ellos, sino a la organización del servicio.\n\nSe percibe una falta evidente de dimensionado tanto en las líneas de inspección como en el sistema de citas. Además, conviene saber que no por llegar antes se entra antes, algo que no está bien explicado y genera frustración innecesaria.\n\nComo apunte práctico: la línea de inspección nº1 es claramente la más lenta, al menos en mi experiencia.\n\nUn servicio que debería ser ágil y previsible necesita mejorar seriamente en planificación y gestión de tiempos."",""Images"":[""www.google.com/local/imagery/report/?cb_client=maps_sv.tactile\u0026image_key=!1e10!2sCIABIhCuMkJbBkxem8bJnuykYzdA\u0026fid=0x0:0x30c03ac2e3ce981e""],""When"":""2026-1-15""},{""Name"":""Mary Carmen Gutierrez"",""ProfilePicture"":""https://lh3.googleusercontent.com/a/ACg8ocIuWEZ-plAOKNTPQr1DfeYQstSLXp7ez62rY3_wAKXM673S3w=s120-c-rp-mo-br100"",""Rating"":4,""Description"":""Esta mañana he ido a pasar la ITV al Palo en Málaga. Quería mencionar la espera tan larga y como algo muy positivo como me ha atendido el profesional que me ha hecho la revisión. Muy amable y educado. Haciendo todo muy bien y sin tardar.Le he preguntado su nombre para hacer una mención sobre él, se llama Francisco  y en el informe de la inspección es el inspector 1482. Ojalá toda la persona q está tratando con el público, se comportara así."",""Images"":null,""When"":""""},{""Name"":""Jose Montoya"",""ProfilePicture"":""https://lh3.googleusercontent.com/a-/ALV-UjWIY7zghFRKD4aHxQlb9vJETFfB7rKcB4Izn6HT2H9ppukq79fY=s120-c-rp-mo-ba3-br100"",""Rating"":3,""Description"":""Normalmente cuenta con 1 hora y hora y media de retraso, solo tiene 3 líneas de trabajo y por muy rápido que puedan ir tarda mucho en avanzar. Quizás se ha quedado algo antigua si se compara con las otras estaciones de inspección en Málaga. Si no te gusta esperar es preferible intentar elegir otro lugar."",""Images"":[""www.google.com/local/imagery/report/?cb_client=maps_sv.tactile\u0026image_key=!1e10!2sCIABIhAXQ0f1p5CsNUNSiSVgROYA\u0026fid=0x0:0x30c03ac2e3ce981e""],""When"":""2025-7-30""},{""Name"":""Juanjo 12"",""ProfilePicture"":""https://lh3.googleusercontent.com/a-/ALV-UjVRZPkpLEJk2qkIMOmPDQp2JNWgpH2WsAbnXHsRHTVhVdz8ihm8=s120-c-rp-mo-ba3-br100"",""Rating"":1,""Description"":""Cómo puede ser que haya tenido que esperar más de un mes para una cita de ITV no periódica cuando en otras CCAA te la dan de un día para otro o en la misma semana? Al final me tuve que ir a otra comunidad.\nEncima suplicándole que por favor tuviesen mi caso en cuenta y diciéndome que son malas fechas (debe ser que todo el mes de diciembre y parte de enero no es laborable)… o igual que tienen poquitas ganas de trabajar y menos aún empatía con la gente."",""Images"":null,""When"":""""},{""Name"":""Edison Rodriguez Barrera"",""ProfilePicture"":""https://lh3.googleusercontent.com/a-/ALV-UjUdh3JJnQqRz3_EeFn6Roqr1VxVc2245MjWPruZpZj2veM8YGBd=s120-c-rp-mo-ba3-br100"",""Rating"":4,""Description"":""Todo muy fácil, no tuve que bajarme del coche para nada, porque todo se puede hacer desde el móvil, el personal muy atento, lo único fue que mi cita era a las 10 y estaban atrasados al menos 45 min, de resto todo muy bien."",""Images"":null,""When"":""""},{""Name"":""malu almaraz"",""ProfilePicture"":""https://lh3.googleusercontent.com/a/ACg8ocJH0qA_qviviY7seS5ELLQVSh5irEo05A4LppVi_MSy1EN7yw=s120-c-rp-mo-br100"",""Rating"":1,""Description"":""La peor Itv que he ido en mi vida.Ya anteriormente me pasó lo mismo y he vuelto ir este año, y me toca un chico echándome atrás el coche porque el volante según el está duro sin arrancar, cosa que es por seguridad y nunca nunca me habían dicho eso, y siempre está igual.Lo lleve a otra itv sin taller ni nada, y paso sin problema.Encima al día siguiente tenía otro vehículo y para colmo el mismo chico me toca y encima me  echa atrás de nuevo la itv por una tontería,y me indica q me acerque después y ya esta.Hay que ser muy mala persona para dejar alguien sin vehículo y siendo nada de nuevo.Regreso a las 20:00 horas y no quieren atenderme,aún no iban a cerrar,y me indican encima que el que me vio, ya se había ido.Tardaron más en cogerme la hoja de reclamaciones que en mirar ,ni un segundo se tardaba ,en darme la itv.Igual,me fui a otra ,y encantadores, en el palo no quieren trabajar y horrible, creo que van solo hacer objetivos,así que no recomiendo para nada esa itv, nunca volveré allí,mal servicio y encima no quieren ni trabajar cuando es su horario de trabajo,diciéndome q es con cita cuando el chico me dijo que llegara ese mismo día y ya esta,y moví cielo y tierra para ir,y me encuentro que no quieren atenderme después de ir."",""Images"":null,""When"":""""},{""Name"":""Koldo Tobal Rios"",""ProfilePicture"":""https://lh3.googleusercontent.com/a/ACg8ocJ53eBN6qJYR98auH2mnvI-C3aPPqB_T8XQWqmJJ7HDSnSWNQ=s120-c-rp-mo-ba2-br100"",""Rating"":5,""Description"":""Super safisfactorio, uno siempre llega con susto a la ITV yo soy de Vélez y al no haber en algarrobo decidí comerla aquí ya que era lo más pronto me atendió un chaval llamado miguel que gustazo dios mío así da gusto ser atendido profesionalidad a tope buena gente serio y simpático a la vez es decir serio para su trabajo simpático con susto trabajo no lo perdáis porque es un diamante en bruto a mi apariencia gracias por todo ❤️❤️❤️🙏🏻🙏🏻🙏🏻🙏🏻"",""Images"":null,""When"":""""},{""Name"":""Dc Dc"",""ProfilePicture"":""https://lh3.googleusercontent.com/a/ACg8ocIGgecmmgm2W4IDQ1w0B2NDu5vLnIrCKZ24GoNOa9qpQrk2Jw=s120-c-rp-mo-br100"",""Rating"":1,""Description"":""La peor estación de itv que puedas encontrar no pase la itv con mi coche nuevo porque la batería estaba levemente suelta y le faltaba un tornillo incluso el mecánico me dijo que apenas se movía y lo segundo fue que la funda de mis asientos que es de una tela muy fina y abierta por los lados no era correcta porque tapaba el airbag del asiento. Por no hablar de la educación del chico cuando me atendia por el walki que era bastante borde cuando apenas se le entendia. Si quieres que te molesten esta es tu estación de itv"",""Images"":null,""When"":""""}]",null,
